id,url,heading,category,date,page,pageSequence,snippet,troveUrl,title.id,title.value,relevance.score,relevance.value,text
4331082,/newspaper/4331082,FIRE IN MOTOR GARAGE.,Article,1924-06-09,6,6,Shortly after half-past 7 o'clock on Saturday morning a pedestrian saw smoke issuing from the window of the office of the premises of Melbourne Motors Proprietary,https://trove.nla.gov.au/ndp/del/article/4331082?searchTerm=text%3A%221+little+bourke+street%22%7E0,13,"The Argus (Melbourne, Vic. : 1848 - 1957)",6.022499,very relevant,"FIRE IN MOTOR GARAGE.

Short]) after half past 7 o'clock on Saturday, mottling u iicdt-httinn san
Hinokc star ing from the amulet or the other of the nitmiKt-boi Melbourne
Motors Proprietary Limited; 1, Little Bourke ""street, near Russell street.
'The fire brigade arrived plaintiff) It sits found that a quantity of bedding
on which one- of the chauffeurs had been letting in the village, had become
ignited The fire was extinguished by fore it could spread 'here some six or
seven motor cars in the garage at the time the fire occurred The gourami- nan
closed about '2' o'clock on Saturday; morning, and no one is as on the par
miles from that hour.

"
2108450,/newspaper/2108450,LICENSES REDUCTION BOARD.,Article,1916-05-22,8,8,The deprivation sittings of the Licenses Reduction Board with respect to hotels in the Gip[?] (Melbourne) licensing district are now being held. In all twenty-eight hotels are listed for [?],https://trove.nla.gov.au/ndp/del/article/2108450?searchTerm=text%3A%221+little+bourke+street%22%7E0,13,"The Argus (Melbourne, Vic. : 1848 - 1957)",5.96698,very relevant,"LICENSES REDUCTION BOARD. 1

is deprivation sittings of the Iltfnsts Reduce ]

Pond with respect to hotels in the pi, I (Melbourne line ing district are row
with k heard

In all twenty eight hotels are listed for wM j Federation at 1 the board, in
accordance lightly

practice is Fianna: students ml inviting an j

ill

life

Well tell

founded -Here . - .

Pin lion 1 Bourke street Duke of York. Hotel, 1, lalt'htrett Her in Hotel I
nth Bourke street""

Pastoral Hotel Bourke street Lota.] Norl'icoUV,

Swanston street Prince's- Theatre IfotiJ saying

I t artnic Hotel Hugill street Mun'ttf i Hotel 1 little Bourke Street
Comiliirul Hotel Spring burn and Rising Sun Hotel Little Bourke street of

"
10572814,/newspaper/10572814,CHARGE OF STABBING.,Article,1903-09-19,19,19,"Last night in Exhibition-street, a man named Robert Burkett was arrested by Constable E. Holden on a charge of stabbing an Asiatie, named abdul rahm, in",https://trove.nla.gov.au/ndp/del/article/10572814?searchTerm=text%3A%221+little+bourke+street%22%7E0,13,"The Argus (Melbourne, Vic. : 1848 - 1957)",5.913374,very relevant,"CHARGE OF STABBING.

last night in Exhibition sheet, a man named Robert I Burl cat was arrested by
Constable L Holden on a charge of stabbing an Asiatic named Abdul Rahim in
Gordon square oil 1 Little Bourke-street on Saturday night last On the night
in question there was with the police describe as

a sin of all round distill h met in the

pitmibPi in Gordon mine and mi Aloud ii Under Rifle appeared at the police
station with a knife wound in his light burst alleging that the one eyed man
is id in (bed it A warrant was then issued for the arrest of Bur nett who has
but one eye The wound which was made with a penknife is not fail to cause
bolton injury

"
4649918,/newspaper/4649918,SHOW VISITOR ROBBED.,Article,1921-09-24,22,22,"Cries of ""Murder"" and ""Police"" were heard in Heffernan lane, off Little Bourke street, early yesterday evening. Residents in the neighbourhood, who hurried to the",https://trove.nla.gov.au/ndp/del/article/4649918?searchTerm=text%3A%221+little+bourke+street%22%7E0,13,"The Argus (Melbourne, Vic. : 1848 - 1957)",5.7561817,very relevant,"SHOW VISITOR ROBBED.

tries of Hunter Hill Police were heard in Heffernan lane off Little Bourke
street Curl yesterday evening Residents in the neighbourhood who hurried to
the spot SIM two men <-trut--ghng with a thud in the scuffle the third man
fell but recovering his ii if and breaking free from his assailant's he ran
into 1 little Bourke-street and told Constables McT cod and UlDOiin time- It""
had been attacked and robbed of a uranus articles He said that he was n of
merit Hncilms Airth md was  in Melt butter for the show Detectives L
O'Sullivan and C Lee visited a Bourke  street hotel later, and arrested two
men

at the use watchhouse later Walter Herbert Rowe 27 sugarcane s employee and
Arthur Howard 47 wharf labourers

are charged with having assaulted and to bed Joseph lliiinpbrev of a gold
collar stud a pocket knife, and 8s in silver Hum place vi is charged with
having been

drunk _______________

"
10712135,/newspaper/10712135,ALLEGED PROHIBITED IMMIGRANTS.,Article,1909-03-31,9,9,"The Chinese Tuck Wah, who was charged with having entered the Commonwealth contrary to the provisions of the Immigration Restriction Act, was yesterday before",https://trove.nla.gov.au/ndp/del/article/10712135?searchTerm=text%3A%221+little+bourke+street%22%7E0,13,"The Argus (Melbourne, Vic. : 1848 - 1957)",5.7553735,very relevant,"ALLEGED PROHIBITED -

IMMIGRANTS. ? ?

-?

The Chinese Tuck W iii Allie, was charged with having entered the
CominoiiAAtnltli contrary to the provisions of the Immigra- tion Restriction
Act, was yesterday before the City Court, on tem and

Detective Inspector Christie stated that the Federal Crown I in. juIIioiiIils
find in structed him to AAitltdi as the present bulge, as the case and a more
than doubtful

one

luck in all arms then disch Argus

Another Chinese 11 Young Sign i c del

activates of 1 Little Bourke street is charged with being a prohibited mining
and

in that he had entered the (original 11th Y within 12.' months after having f
liked t up in

the dictation test

Mt Croft appeared for the deft ml ml

On the application of Deteitm inst elm Christie a. remand was granted till
Ihm.

do next !

bail was fixed at one s feet of £100 j

"
2150459,/newspaper/2150459,FATALLY INJURED. Victim Identified.,Article,1925-08-03,13,13,The man who sustained shocking injuries when he was knocked down in Flinders street by a motor-car on Friday evening was identified on Saturday. In his,https://trove.nla.gov.au/ndp/del/article/2150459?searchTerm=text%3A%221+little+bourke+street%22%7E0,13,"The Argus (Melbourne, Vic. : 1848 - 1957)",5.6547923,very relevant,"FATALLY INJURED.

Victim Identified.

the man who sustained shot king in pains of hell he was knocked down in Jim
lit i start his motor car on J'jidnt even in. this identified on Saturday In
his I »J--KJII mu letters addressed to a ) KIL win Rail It stated 1 cover it
In tactician nth disclosed that, the man's full point win. Andrew Innes
cousin, that he had followed the usurpation of 11 seaman's I Hint his
address-, had bros (161 still It 1- Little Bourke street, pitt

Winn 1 minister at the Melbourne Dos pill on 1 within night it was found that
Edwin find heartened double 1 (impound I u once of both legs, a fine time of
the 1 0 if the si all other head injuries linings. and abrasions He died
shortly after idiniltniK'e to the Gallipolli] Pan. II 1 inn was stated in WA
than Eden, Hill 21 years of Bioiigbuiii street, kew h 34 m stepped ill is out
of the city

"
1526736,/newspaper/1526736,A PECULIAR WILL.,Article,1915-06-24,6,6,"Michael Sheil. I[?] of Park street, St. Kilda, who in the sixties was a baker carrying on business in Little Bourke street, and who died on the 21st January. 1904,",https://trove.nla.gov.au/ndp/del/article/1526736?searchTerm=text%3A%221+little+bourke+street%22%7E0,13,"The Argus (Melbourne, Vic. : 1848 - 1957)",5.5577765,very relevant,"A PECULIAR WILL.

Alithail Shed late of Pirie street I

Ixildi n who in the sixties of is a bill uni

ing on business in 1 little Bourke street md who

died on the list I am in 1904 di

i cited in his and that after the death of his

wife (who died recently) I had ever run should

utilise his e till and apply the grounds

firstly to pin in He persons whose name is I appeared in his insolvency si In
('the third in the Court if Insnlitnit at Melbourne on or about the 21st of
full 1801 thin debts in full without interest and if any of such

persons should practise line in become

insolvent then to pay the amounts to their legal upiisontntiiis and so only to
put Girl in His, wits its in the and sit out In another column may be found an
address ment by the National Trustees Company

the executors under i the still asking the traditions of Ultu near of I in to
(omnium cate with the company so that taste for s wishes can be complied with

"
10866574,/newspaper/10866574,SLY GROG-SELLING. £50 FINES IMPOSED.,Article,1910-06-24,4,4,"An Lee, a Chinese, was charged in the District Court yesterday with having sold liquors without a license at his premises, 120 Little Bourke-street. There were four separate charges against the",https://trove.nla.gov.au/ndp/del/article/10866574?searchTerm=text%3A%221+little+bourke+street%22%7E0,13,"The Argus (Melbourne, Vic. : 1848 - 1957)",5.556974,very relevant,"""""Y GROG-SELLING.

as

. £50 FINES IMPOSED.

Ah Lee, a Chinese, was charged In the District Court yesterday with having
sold liquors without a license it his promises, 120 1 Little Bourke street

There were four separate charges against the accused, and Mr McFarlane who
defended said that his client was prepared to plead guilty, to one. charge if
the remainder were withdrawn

Inspector Dat les (who conducted the prosecution expressed willingness to
withdraw the offer charges upon condition that a fine of 100 was imposed in
regard to the first

A penalty of £50, or three months' imprisonment in default, was inflicted In
respect to the charge which the Chinese- had admitted

Cornelius 0 Ditto, Nathaniel Van, and Dinah Van were not proceeded against
upon a sand bar charge alleged to have been committed on premises in Russell
street, on May 22 Mr

Sonenberg, who appeared for the defence, suggested that as the charges all
referred to one house a fine of £20 should be imposed in the case of Nathaniel
Van, who would plead guilty, and that the charges against the others be with

drawn

Inspector Davies acquiescing, this course was adopted

"
1840657,/newspaper/1840657,DEPORTED GERMAN'S CLAIM.,Article,1922-08-24,6,6,"Max Bagemuhl, now resident in Germany, claimed from the German Government £250 for losses sustained by him during the war. In his claim Bagemuhl said",https://trove.nla.gov.au/ndp/del/article/1840657?searchTerm=text%3A%221+little+bourke+street%22%7E0,13,"The Argus (Melbourne, Vic. : 1848 - 1957)",5.462807,very relevant,"DEPORTED GERMAN'S CLAIM.

Mix Ilageiniilil, now resident in Germany, claimed from the German (idea ment
£2.10 for losses sustained by him during the war. In his claim Dagciniilil
said that while he was carrying on a measure business at (1 Little Bourke
street, Melbourne, on December 27, 101% he rest In terms of li) (lie
Aimltnllin (internment has left in his rooms all his belongings, including a
massage apparatus of his men women- tion, and 1m mined them fit _-V>

Willing to the chief roiniiiissioner of Police (Mr. Nicholson) on June 30,
last Hunde der Ausländsdeutschen, Merlin, station said that it was authorised
by the (best man (Government to inquire into all such claims as that made In
ll.i.ciiiuW, asked the chief commissioner to list is maries made out! to
furnish a statement

The plans for lies police have found that Max Ilageiniilil in December, will,
vii to rested in (Geelong on a charge of a vagrancy, He was sentenced to six
mint has' imprison merit, to be forfeited li) internment and ilepitntlt.ii. He
was not known at 8 Mills Hum he street at (the registering of the war, and so
far there has been in covered no extreme of its ever having quietly on a
liiu.¡iie-.n at that address

"
10819542,/newspaper/10819542,VALUABLE FURS STOLEN. THREE YOUTHS CHARGED.,Article,1914-11-28,21,21,"There youths, William Howard, Donald Halfield and Walter Jones,were charged at the City Court yesterday with shop-breaking and the theft of a musquash coat and [?], valued in all at £222, the",https://trove.nla.gov.au/ndp/del/article/10819542?searchTerm=text%3A%221+little+bourke+street%22%7E0,13,"The Argus (Melbourne, Vic. : 1848 - 1957)",5.3723903,very relevant,"VALUABLE FURS STOLEN.

TERM', YOUTHS Car. UrGED.

river i intend, William Howard Doml I Hatfield 1

and Muller Jones was charged at the City Court  Festiniog with shop Trial ing
and the theft of a musquash iron and inn, l think in all at 22 the property of
Alfred W lok« furrier. 120 Bourke street They pleaded. not guilty

1 Evidence was given that the furs were missing from the shop in the morning
of November 17 1 not once had been effected through a fanlight at the ear of
the shop Jones and Hatfield took a room at '""1 Little Bourke street, on Cup
day and! on November 4"" the 1 in limits, Margaret A Mr-on saw them enter the
he uses will Howard I men was carr) in a bog He said to her I look after the
nom tor I have put Valuable parcels there littleness Nipthine rail I then
arrested around and line, on November 19 in West Mel bourne Ilallloll had been
erected in the pre along du on 11 other charge In the room taken by Jones and
Hutllcld almost all the furs we""

record i in

the time men were committed for trial at the Court of General Sessions on
December 4

Messrs T O Callaghan (chairman), W Bell, and C, Goldspink who (on, he Bench,

"
197521973,/newspaper/197521973,ADJOURNED QUARTERLY LICENSING MEETING FOR THE CITY OF MELBOURNE.,Article,1861-03-16,12,12,"An adjourned quarterly licensing meeting for the city of Melbourne, was held on Tuesday at twelve: o'clock, before the following magistrates:—Messrs Stuart, O'Brien, M'Carthy, and Dr.",https://trove.nla.gov.au/ndp/del/article/197521973?searchTerm=text%3A%221+little+bourke+street%22%7E0,958,The Melbourne Leader (Vic. : 1861),5.283189,very relevant,"ADJOURNED ftUJVRTERIiY LICEN^][N0: ? MEETING ?OR THE -CITY OF MEL ; BOURNE.
?''?????!'-''-'-1''11 |-

4 An' adjourned' quarterly licehsirig meeting' for ' the 'city of Melbourne,
was held on Tuesday at twelve ^o'clock, ; ;before,aefpUpwing. magistrates :e
Messrs rSturt.r.iO'BtienV^M'Carthyj and Dr. Tieniey. .'?' ','i-J ''????? -i^j
v- ; ')-- r.* -s , '^::\i ,:;/!.:? ? The ^following- applications were heard
:~Tran'8- ;

ler ot .license, \Villiani Thompson Burton,1 Ship Inn, ? Flinders lane, from
Wm. '- John' -Morris. Granted, i New applicaHt ;fof a;houae ipreyidusly*
licensed, James Noonan, Limerick Castle,' ;Eliza-- beth street. -::.Q;rantedte
Confectioner's license, Owen Joseph, $1 Little, Bourke street... ^To, -ap-
pearancei ,.?'.:'.'.?'/??'.'? :,'' ''?'?.'?' ''?'''' ''-'''i': ''
'.The'public'aiis.wb.pse^ ^^.licens'e? had been'granted' at1 the
;prevjous;'meeti^g,i dyly, entered ixitb1 tteir ? recdgnisances.;'^.'1-- '
\'-\ 'r;'.''.j.,'''l''' .'^ '''.... ^/.V''': .' '\ .. . Splendii) S#H0^y of
GoLtf.^-Lr addition to' their; usually rich display* the .Oriental Bank, on.
Sa turday, ' exhibited a- very rich: cake of ainalga-.' mated, gold, weighing
t about 400 m, prushed at' thejTJnion Mijls, Sheepshead. ,Ther.caHe lis^ono of
the purest and best retorted specimens i wo have seen for some time. What is
rather , curious , in retortirigVjiBome'bf' the very fine gold , 'ascending-
into the retort pipe, formed a , splendid looking ringor brooch, which ihe
pwners intend preservn ing for an ornament o the \&a.;$;~B-indigq A tuer,
Match i . ? , ,'.- .- '.,''.'-, ' ? ?'. -

"
2147606,/newspaper/2147606,WOMAN REPORTS ASSAULT. Money in Handkerchief Taken.,Article,1925-10-05,18,18,"When taken to the Ho[?]pathie Hospital on Saturday night Mrs. Lavinia Donald, of Faraday street, Carlton, told Constable Nevins that she had been",https://trove.nla.gov.au/ndp/del/article/2147606?searchTerm=text%3A%221+little+bourke+street%22%7E0,13,"The Argus (Melbourne, Vic. : 1848 - 1957)",4.888822,very relevant,"WOMAN. REPORTS ASSAULT.

Money in Handkerchief Taken.

When taken (to the Hoiiircopiithic Hon William in Sfiliuilnv night Miss
Lavinia Bonall!, of Faraday-street Carlton, told Constable Means that she had
been its suffered by two men in a lane off City road, South Melbourne.
According to his son to the police, she left her home about 7 o'clock and bom
dod u Port Melbourne tram in Spring street to go to the house of a friend in
Little Mountain street, South Melbourne She noticed two men on the dummy of
the tram. At the corner of Clarendon has let and Cab land she alighted with
the intention of boarding a South Melbourne tram. She milked along the road,
and, following her into a lane, the men asked for money. When she refused they
struck her, she alleged, on the face, and took his handkerchief containing a
10/ note and 2/6 in silver. The men then ran away. Mrs. Donald then went to li
shop occupied by Mrs, Crooks, at the collier of City road and Clarendon
street, and informed the police. Constable Ncwnv took her to the Homoeopathic
Hospital, where she was treated for a cut over the

and facial abrasions. Senior-detective C. Bell interviewed the woman at the
hospital.

Two Men Attacked.

the on Saturday night to Young, aged 21 'A, of Canning street, Carlton, and
George de Grande were assaulted by two unknown men in 1 Little Bourke street.
No attempt was made to rob them A constable took the two injured men to the
Melbourne Hospital, where they were treated for slight head and facial
injuries

Woman Slightly Injured.

Stating' that she had been piratical by a man, Henry Hill, ""Bed IS your, el
O'connell street, -North Melbourne, was treated at the Melbourne Hospital on
Saturday night for ficial injuries

Champion Lincoln lines at the Royal Show, See illustrations in ""The
Australasian,"" Saturday, October 28.

"
241609183,/newspaper/241609183,LIFT ACCIDENT. A CHINESE DANGEROUSLY HURT.,Article,1898-07-15,1,1,"A Chinese market gardener, named Ah Kye. about 35 years of age, who resides at Brunswick, met with a very serious accident at a restaurant situated",https://trove.nla.gov.au/ndp/del/article/241609183?searchTerm=text%3A%221+little+bourke+street%22%7E0,1190,"The Herald (Melbourne, Vic. : 1861 - 1954)",4.887329,very relevant,"LIFT ACCIDENT.

a chinese dangerously hurt.

A Chinese market gardener, named Ah ICye. atsxut S3 years nf age, xvho resides
at Brunswick, met with a very serious accident at a restaurant situated in
VlnegrnwotV Club, Collins street

west, to-uny. shortly after seven o'clock this morning Ah Kye drove to the
restaurant, as lie generally did. for the purpose of taking away feed for his
pigs. How the accident happened Is . not known, but shortly after Ah ICve's
arri val at the restaurant he rushed Into, the kitchen in a dreadfully mangled
condi tion. A portion of his face xvas cut off. and ldood xvas streaming from
his head unci jaw. He muttered something hi an Incoherent manner, rushed out
of the kitchen again. Jumped into ids cart, and drove to a Chinese |»ork shop,
No. 21-1 Little Bourke street; LVufUahle .M'Muhmi xvas enllod In, and
ascertained from Ail Kye tliut he had been hurt ill thu lift at the
restaurant. He could give no further explanation, ns lie was In a dazed and
collapsed state. M'.Mnhnn nt once took Ah Kye In a cab to the Melbourne
Hospital, where Dr. Harold South found that his skull and Jaw xvere fractured,
a j»ortlon of bin nose had been cut off. hud there was a very severe wound
across his face. The Injured celestial xvas admitted to the hospital, hut Dr.
South conddert that his recovery Is very Improbable indeed: in fact, his case
is considered a hopeless Tlie constable xvent to tlie restnurnut, and upon
examining the lift found Idood marks nil over It. especially about the top
portion. The conclusion arrived nt xvas that Ah Kye stood loo close .to the
lift as It xvas ascending, and that he was struck by the lop portion, and also
hud his head Jammed between the lift and one of the openings on the first
tlonr. No person saw the aeeldent, and how it hajipcned must he purely a mn t
- tt r of conjecture.

"
10836649,/newspaper/10836649,HAWKING IN THE CITY. PROHIBITED AREA EXTENDED.,Article,1910-02-22,6,6,Consideration of the question of hawking fruit and other commodities in the city was given by the City Council yesterday. A report was submitted by the market,https://trove.nla.gov.au/ndp/del/article/10836649?searchTerm=text%3A%221+little+bourke+street%22%7E0,13,"The Argus (Melbourne, Vic. : 1848 - 1957)",4.8859863,very relevant,"HAWKING IN THE CITY.

PROHIBITED AREA EXTENDED.

Consideration of the question of hawking fruit and other commodities in the
city was given by the City Council yesterday A. report was submitted by the
market committee in which it was proposed that the pro- hibited area be
extended by the inclusion of Collins street from Elizabeth street to Queen
street and of 1 Elizabeth street to the north side of 1 Little Bourke-street
It was stated that a special committee of the public works legislative and
market committees which had been dealing with the matter

had three policemen engaged in moving the bowl is on in Collins street but the
slow cross traffic in Collins street seriously in peded vehicular li if he
along the street With regard to the obstruction in front of the Post-office
the deputy Postmaster General

laid on several occasions complained of the complete blocking of the Elizabeth

street frontage of the Post office |

-dennis Crichton moved that the report of the committee be adopted

Councillor Mary's submitted an amendment providing that the prohibition
against hawking m I Lambeth street should be extended

to lined the street

Councillor valued seconded the amend-

meat

A general discussion on the question of hawking ensued III which the opinion
was expressed that the extension proposed by the committee was reasonable It
was pointed out that if it was found advisable  to further increase the
prohibited area it could be done at a later date Several councillors argued
that consumers who were unable to pay the high charges charged by shopkeepers
s were entitled to be considered

The amendment of Councillor Marks providing that the prohibited area in
Elizabeth street should be extended to Lonsdale-street and that the western
boundary in Collins street should be Queen street, was agreed to

Councillor Allen moved that the king should he disallowed in Flinders street
between 1 faileth and Queen streets but this was disagreed with

"
4097855,/newspaper/4097855,FIRE IN CITY SHOP. TELEPHONE DELAY. Call During Special Drill.,Article,1930-07-05,22,22,Inability by a telephone subscriber to establish communication with the central exchange last night caused a delay of nearly 10 minutes in summoning the fire brigade,https://trove.nla.gov.au/ndp/del/article/4097855?searchTerm=text%3A%221+little+bourke+street%22%7E0,13,"The Argus (Melbourne, Vic. : 1848 - 1957)",4.7442083,very relevant,"FIRE IN CITY SHOP.

TELEPHONE DELAY.

Call During Special Drill.

Inability by a telephone subscriber to establish communication with the
central r ""change last night caused a delay of nearly

150 minutes in summoning tin his brigade to

an outbreak of Little Bourke street j I Shortly after half-past 9 o'clock Miss
I Thelma Lester, hairdresser, who occupies a

premises on the north side of Little' Bourke street, between Swanston and,
Elizabeth streets, heard a noise which at tracted the attention Looking out of
a Window see any smoke issuing from a three storey building- at the corner of
1 little Bourke street and Arcade like, owned by Mr J Morell, and occupied by
the Miss

ment 1 furniture t Company Although two man in the street, - and that the
youth took a street in alum Miss le ster de decided to summon the brigade by
telephone

I -Se at lo li) minutes pi upset however, be fore she could attract the
attention of the big

plunge dorm, which time the same hue and

I seek the erection of the chief fire officer i

(Mu I Wilkins), had arrived at the scene

of the fire It was found in his ear that the

outbreak, the i am of which was a

known, bad originated in the centre of the , first floor the flames which had
sp and to the n me of the building an 1 in the second floor nee quid li
subdued, in . though consider able dam is. was caused to the stock in that
part of the building. The contents of! the ground floor, although jun I tested
by the future with tarpaulins was

damaged liv was run The building was only a slightly damaged The amount of the
damage could real It assessed last night, but

could particulars it the usual ones be issued a

t lined i

The outbreak. erected while a special dull by the firemen of the Eastern Hill

station w is in progress before the all colour]

of the Metropolitan fire Brigade ((and

after a 1 show a red and members of the

s eildon Uni ct Hub I

"
