id,url,heading,category,date,page,pageSequence,troveUrl,title.id,title.value,relevance.score,relevance.value,snippet,edition,text
5705099,/newspaper/5705099,Family Notices,Family Notices,1861-10-17,8,8,https://trove.nla.gov.au/ndp/del/article/5705099?searchTerm=text%3A%226+little+bourke+street%22%7E0,13,"The Argus (Melbourne, Vic. : 1848 - 1957)",6.9507675,very relevant,,,"Funeral Notice.

THE Friends of Mr CORNELIUS NORRIS are

respectfully invited to follow the remains of his late son, Cornelius, to the
place of interment, Mel- bourne General Cemetery. The funeral to move from his
residence, 6 Little Bourke-street west, this day, Thursday, 17th inst., at 3
o'clock p.m.

JOHN DALEY, undertaker, La Trobe and Spring

streets, Melbourne.

"
205390565,/newspaper/205390565,"City Property for £25,500",Article,1954-05-26,10,10,https://trove.nla.gov.au/ndp/del/article/205390565?searchTerm=text%3A%226+little+bourke+street%22%7E0,809,"The Age (Melbourne, Vic. : 1854 - 1954)",6.918457,very relevant,"A property situated at 542-6 Little Bourke Street, city, brought £25,500 at auction yesterday.",,"City Property for £25,500

A property situated at 542- 6 Little Bourke Street, cify, brought £25,500 at
auction yesterday.

Tne li.uuu square leet pro perty had a two-story bricx building on It.
Bcntleigh. — 3J0 Centre Road, brlek shop and dwelling, Ave rooms, passed In
£2100, reserve £2500 (Slmmonds). West Melbourne. — 65 Stanley Street, two-
story brick, 10 rooms, V.P., £5600 (A. W. Ste vens),

"
261751020,/newspaper/261751020,Dance Rental by V. Goldman,Article,1951-02-02,11,11,https://trove.nla.gov.au/ndp/del/article/261751020?searchTerm=text%3A%226+little+bourke+street%22%7E0,1685,"The Australian Jewish News (Melbourne, Vic. : 1935 - 1999)",6.8867464,very relevant,"Vera Goldman, the Israel dancer, wil give a recital of modern dance at the Union Theatre (Melbourne",,"Dance Rental by

V. Goldman

Vera Goldman, the Israel dancer, wil give a recital of modern dance at, the
Union Theatre (Melbourne Univer sity) on February 22 and 24.

The programme will in clude Israel dances and Bib lical themes.

Preliminary bookings will open on Friday, Februarj* 2, at the Kadimah and Kan
tor’s Bookshop, 23 6 Little Bourke Street, Melbourne.

Some tickets will also be available at the “Zionist” of fice.

"
10658550,/newspaper/10658550,A PLAGUE OF THE NIGHT.,Article,1908-05-16,17,17,https://trove.nla.gov.au/ndp/del/article/10658550?searchTerm=text%3A%226+little+bourke+street%22%7E0,13,"The Argus (Melbourne, Vic. : 1848 - 1957)",5.4644647,very relevant,Itching Piles and Other Itehing Skin Troubles Cured by Doan's Ointment. About one person in every four suffers from some form of skin complaint. Skin,,"A PLAGUE OF' THE NIGHT.

Itching Piles and Other Itching Skin  

Troubles Cure by Doan's Ointment.

About one person in every four suffers from some form of skin complaint. Skin
disease is very obstinate to cure, and there is a tendency to become chronic.
But no one need suffer, for Doan's Ointment has   been proved to cure every
teasing skin   irritation of the skin — Piles, Eczema, Hives,   Sores, Insect
Bites, Chilblains, &c.; Then   get a pot of this wonderful remedy to-day;  

it is soothing and healing, and will bring you lasting relief.  

Mrs. Nugent, 6 Little Bourke-street west, South Melbourne, says:— ""I cannot
speak   too highly of Doan's Ointment for healing   the skin and for skin
complaint. This     preparation is soothing and comforting. I have used it,
and I know its value. I have also found it excellent for eruptions of the
skin, cuts, sores, and anything else wrong with the skin. I have recommended
it to   many sufferers, and all are unanimous in declaring it the finest skin
remedy on   earth.""  

A year later Mrs. Nugent says:— ""I have   the greatest faith in Doan's
Ointment; it   cured me of an irritating skin complaint twelve months ago, and
I am still quite right."" Doan's Ointment is splendid in   all diseases of the
skin; it is perfectly safe,     and very effective. Very often two or three
pots have cured chronic cases which have resisted other remedies for years.
Doan's     Ointment is sold by all chemists and store- keepers at 2/9 per pot,
or will be posted on     receipt of price by Foster-M'Lellan Co., 76
Pitt-street, Sydney.

But be sure you get DOAN'S.—[Advt.]  

"
140715045,/newspaper/140715045,BUILDING FALLS.,Article,1925-06-27,46,46,https://trove.nla.gov.au/ndp/del/article/140715045?searchTerm=text%3A%226+little+bourke+street%22%7E0,460,"The Australasian (Melbourne, Vic. : 1864 - 1946)",5.302417,very relevant,"With a crash of failing girders and bricks a three-storied building, owned and occupied by Mr. A. H. Enticott, art engraver, at 394-6 Little Bourke street, Melbourne,",,"BUILDING FALLS.

With a crash of failing girders and bricks a three-storied building, owned and
occu- pied by Mr. A. H. Enticott, art engraver, at 394-6 Little Bourke street,
Melbourne, at the rear of Kirk's Bazaar, subsided on its foundations on the
afternoon of June 24, and precipitated half its eastern wall into excavations
which were being completed on the adjoining site on the corner of     Wright's
lane, for the erection of the new Hardware Club building. No one was injured,
but the damage, is estimated at £12,000, the building having been ruined.
Premonitory cracks and rumblings which

The scene immediately after the accident, showing Little Bourke street and the
collapsed wait of the building,

from which bricks were falling after the photograph was taken.  

had been heard since shortly after 2 o'clock gave warning to the employees on
the premises, numbering 18, and all escaped. Workmen in the excavations next
door also escaped just in time, after having removed six drays and horses. The
cause of the accident is attributed to the ""greasy"" nature of the ground about
the foundations. To what extent the ad- joining excavations contributed will
be in- quired into by the city engineer (Mr. H. E. Morton). An extraordinary
sequel to the collapse of the building was an attempt, in the dusk, under Mr.
Morton's direction, to wreck the remainder by a fire-hose, be- cause the
tottering walls were dangerous. The pressure of water, however, only loos-
ened sections of the wall, as the girders in falling had locked on a dividing
interior wall. An effort will be made to blast away the obstruction. The
wrecked building was constructed in brick in 1902. It adjoined the old
Governor Arthur Hotel, which was delicensed in 1918. The old hotel had been
converted into offices and a factory, but it has now been almost demolished to
provide a site for the new seven-storied reinforced concrete building of the
Hard- ware Club.

"
5853078,/newspaper/5853078,Family Notices,Family Notices,1873-05-06,8,8,https://trove.nla.gov.au/ndp/del/article/5853078?searchTerm=text%3A%226+little+bourke+street%22%7E0,13,"The Argus (Melbourne, Vic. : 1848 - 1957)",4.375026,very relevant,,,"Funeral Notices.

INDEPENDENT ORDER of RECHABITES : ROSE

of DENMARK FEMALE TENT, No. 4—The mem- bers of the above Tent and the Order
generally are re- spectfully invited to assemble at the main entrance,
Melbourne General Cemetery, at 3 o'clock THIS DAY, to pay the last mark of
respect to their departed sister SARAH WHITING, late of 81 Brunswick-street,

Fitzroy.

E. A. CLAPHAM, Secretory.

THE Friends of Mr. J. WHITING are respectfully

invited to follow the remains of his late beloved wife to the place of
interment, the Melbourne Ceme-

tery.

The funeral to move from his private residence, Palmer-street, off Brunswick-
street, Fitzroy, THIS DAY (Tuesday, 6th May, 1873), at half-past 2 o'clock.

G. H. ROBSON, undertaker, 116 and 118 Bruns wick-street, Fitzroy.

THE Friends of the late Mr. CHARLES APPLE-

TON are respectfully invited to follow his remains to their interment, in the
Melbourne Cemetery, leaving his late residence, 8 Gertrude-street, Fitzroy,
THIS DAY (Tuesday), at 3 o'clock p.m.

WILLIAM GEORGE APPS, undertaker, Fitzroy and Moor streets, Fitzroy. THE
Friends of Mr. CHARLES BOLWELL, builder, are most respectfully invited to
follow the re-   mains of his late beloved wife to their last resting place,
the Melbourne General Cemetery.

The funeral procession is appointed to move from his residence, Canning-
street, Carlton (next to the United States Hotel), THIS DAY (Tuesday, the 6th
inst.), at 2 o'clock punctually.

WILLIAM GEORGE APPS, undertaker, Fitzroy and Moor streets, Fitzroy.

THE Friends of Mr. CHRISTOPHER NORRISS are

respectfully invited to follow the remains of his late mother-in-law, Mrs.
Mary Hannan, to the place of interment, the General Cemetery.

The funeral to move from her son-in-law's residence, 5 and 7 Little Bourke-
street west, THIS DAY (Tuesday), at 3 o'clock. THE Friends of the late Mr.
JOHN KNIGHT, butcher, Bay-street, Sandridge, are respectfully   invited to
follow his remains to the place of interment, Melbourne General Cemetery.

The funeral to move from the Graham Family Hotel, Graham-street, Sandridge,
THIS DAY (Tues- day, 6th inst.), at 2 o'clock.

W. H. NEWMAN, undertaker, Bay-street.

THE Friends of Mr. MICHAEL BROLAN are

respectfully invited to follow the remains of his late wife to the place of
interment, the Melbourne

General Cemetery.

The funeral to move from his residence, 8 Charles terrace, Charles-street,
Carlton (near the Victoria Hotel), THIS DAY, at 1 o'clock p.m.

JOHN DALEY, undertaker, Latrobe and Spring streets. Melbourne. THE Friends of
Mr. JOHN HANNAN are respect fully invited to follow the remains of his late
wife   to the place of interment, Melbourne General Ceme-

tery.

The funeral to move from the residence of her son- in-law, Mr. Christopher
Norris, 6 Little Bourke-street west, THIS DAY. 6th inst., at 3 o'clock p.m.

JOHN DALEY, undertaker, Latrobe and Spring streets, Melbourne.

THE Friends of Mr. PATRICK McNAMARA are

respectfully invited to follow the remains of his late wife to the place of
interment, Melbourne General

Cemetery.

The funeral to move from his residence, Church street north, Fitzroy, THIS
DAY, 6th inst., at 1 o'clock

p.m.

JOHN DALEY, undertaker, Latrobe and Spring

streets, Melbourne.

"
183030357,/newspaper/183030357,Advertising,Advertising,1933-02-01,7,7 S,https://trove.nla.gov.au/ndp/del/article/183030357?searchTerm=text%3A%226+little+bourke+street%22%7E0,875,"Sporting Globe (Melbourne, Vic. : 1922 - 1954)",0.6918802,likely to be relevant,,Edition1,"RUNNERS! RUNNING SHOES TRY BAINESI PRICES: 25/ to 35/ TO MEASURE . AS
iSupplied to J. Fltt Country Orders Receive Prompt Attention. 456 Bourke
Street. Corner of Queen Street Cent. 1841. Write for Special Measure Chart.
Postage: Victoria 1/; Interstate 1/6. WEENEY'S RUNNING SHOE Jiasea by the
OLYMPIC RUNNERS. Golding, Barwick and Hillhouse. 2(6 Little Bourke Street,
Melbourne. Jaseball and Cycle Shoes Made to Order

"
258664048,/newspaper/258664048,Advertising,Advertising,1925-05-07,4,4,https://trove.nla.gov.au/ndp/del/article/258664048?searchTerm=text%3A%226+little+bourke+street%22%7E0,1585,"Sunraysia Daily (Mildura, Vic. : 1920 - 1933)",0.68494314,likely to be relevant,,,"ABSOLUTELY NECESSARY FOR EVER) GOOD MEAL Good-bve, Daddy, don't forget
COWARD'S BREA1 Fresh, Wholefome and Appctisinu. Delivered Daily Anywhere.
Consign Your Citrus Fruits Ti H. LOUEY PANG & CO. PTY. LTD.| 172—6 LITTLE
BOURKE STREET, MELBOURNE Account sales promptly rendered with clu-qii"" imoH
diaii ly alb- 1\. P will iinil us .Stiiiicils and advice notes sent on
application.

Read and Advertise in the Special RED CLIFFS EDITION Every Thursday

?

"
258679002,/newspaper/258679002,Advertising,Advertising,1925-07-29,6,6,https://trove.nla.gov.au/ndp/del/article/258679002?searchTerm=text%3A%226+little+bourke+street%22%7E0,1585,"Sunraysia Daily (Mildura, Vic. : 1920 - 1933)",0.659674,likely to be relevant,,,"WONDERLAND TONIGHT \- TONIGHT Two Big Pictures Southern Love Featuring BETTY
BLYTHE and

What did the Sphinx tell her— Nothing! But marriage is a big gamble — it has
many pitfalls—it's a gaim.' of rhancc until the man and woman can see the
light. Come, learn of marriage secrets from i worldly wise widow! featuring
DORIS KENYON el veil .Stalls, I II, I I; l'rulll Slalla, I 1. Ml. Hook \,,u
Consign Your Citrus Fruits To H. LOUEY PANG & CO PTY. LTD. 172—6 LITTLE BOURKE
STREET, MELBOURNE Account sales promptly rendered with cheque Immediately
after sale. ""L P"" will find UB. Stencils and advice noteB sent on application.

"
258676712,/newspaper/258676712,Advertising,Advertising,1925-07-22,6,6,https://trove.nla.gov.au/ndp/del/article/258676712?searchTerm=text%3A%226+little+bourke+street%22%7E0,1585,"Sunraysia Daily (Mildura, Vic. : 1920 - 1933)",0.6355987,likely to be relevant,,,"STAR PICTURES ""FIRST WITH THE BEST TONIGHT TOWN HALL TONIGHT PIG DOUBLE
FEATURE PROGRAM Wanda Hawley Wiih NIGEL BARRIE ; \ "" Fires of Fate"" SUPPORTED
BY A'. Christie's C-.-eat Laughing Feature. "" Reckless J9 i t-t 1. ROY BAaNES.
MARRY MYLRS WANDA hAWLi-Y. -1 • .YiA 2R£A.MER and TLLLY .MARSHALL. CCIiilNG
FRIDAY AND SATURDAY NEXT ""MANHATTAN"" With RICHARD DIX Consign Your Citrus
Fruits To H. LOUEY PANG & « O PTY. LTD. 172—6 LITTLE BOURKE STREET, MELBOURNE
Ai iuuii; ?HI'-6 promptly rendered with cheque Immediately after «ale. ""L P""
will And us. SIII-I-i',? ar.rl advice no'.es sent OD application

Read and Advertise in the Special RED CLIFFS EDITION Every Thursday SOTTOMS
PLAYER-PIANOS From £195 Your Old Piano Taken in Part Payment. EASY TERMS.
Inspect the Stock of Beautiful Instruments at

"
258667610,/newspaper/258667610,Advertising,Advertising,1925-06-03,1,1,https://trove.nla.gov.au/ndp/del/article/258667610?searchTerm=text%3A%226+little+bourke+street%22%7E0,1585,"Sunraysia Daily (Mildura, Vic. : 1920 - 1933)",0.62971747,likely to be relevant,,,"Read and Advertise in the Special RED CUFFS EDITION Every Thursday Consign
Your Citrus Fruits To H. L O U E Y P A N G & CO PTY. LTD. 172—6 LITTLE BOURKE
STREET, MELBOURNE Account sales promptly rendered with cheque Immediately
after sale. ""L P"" will find us. Stencils and advice notes sent on application.

L. K. WOON PRACTICAL CHINESE HERBALIST of sr> Gertrude Street, Fitzroy.
Melbuurnp 82 Madden Ave., Mildura (two doors from Recreation Club) TREATS ALU
COMPLAINTS AND DISEASES, INTERNALLY AND EXTERNALLY, WITHOUT OPERATION.
INJURIES ATTENDED TO. SPECIALIST IN RHEUMATISM. GUARANTEED TO CURE FITS. Two
years nuo I dcvclopr-d Internal trouble, and suffered intensely. I •up tn-
ati'd liy^Ix iliflYrent iluctors, and after several w^eks, part of which •ere
spent, .in the lin^-pllHl. my case was pronouiut-J incurable, and f I'lumcil
lionie. appnrently to die.

"
258669142,/newspaper/258669142,Advertising,Advertising,1925-06-17,6,6,https://trove.nla.gov.au/ndp/del/article/258669142?searchTerm=text%3A%226+little+bourke+street%22%7E0,1585,"Sunraysia Daily (Mildura, Vic. : 1920 - 1933)",0.6244425,likely to be relevant,,,"Star Pictures TONIGHT! TOWN HALL TONIGHT! Big Double-Feature Program ANNA Q.
NILSSON IN INNOCENCE A picture that will ihrill you with its keen-edged drama,
delight you with its comedy, hold you spell-bound with lis re.iiai kabic story
interest. Also S.:-ccial Additional Attraction < Syd. Gregory I.ATB TlY-'I.l
niPTI'I S. AI.*"" -MOSS A- £Te>],l, i 'I lie T IT.-:. 1,""NPH\\. A Musical Treat
V. ,! inns; i:e:ir beaut ful Hawaiian (iuilar. ADMISSION: ! <: Mini 1 'plus
tarn. hiielr, :i. Hair-I'rcr-.

THEGUDEAWAY THE GLIDEAWAY THE GLIDEAWAY SKATING Hie Popular Winter Amusement
SLATING Monday. Thursday and Saturday Evenings. LEARN TO SKATE ON' WEOVh'SUAY
AFTERNOONS Consign Your Citrus Fruits To , H LOUEY P*NG>& f'O PTY. LTD. 172—6
LITTLE BOURKE STREET, MELBOURNE Account sales promptly rendered with cheque
Immediately after sale. ""L P"" will find us. Stencils and advice ootes sent on
application. Printing Problems Are all urisfatrorilv tolved bv ""Sunraytia
Daily""

?

"
258677786,/newspaper/258677786,Advertising,Advertising,1925-07-25,7,7,https://trove.nla.gov.au/ndp/del/article/258677786?searchTerm=text%3A%226+little+bourke+street%22%7E0,1585,"Sunraysia Daily (Mildura, Vic. : 1920 - 1933)",0.61342967,likely to be relevant,,,"REID BROS, for TIMBER and JOINERY l'lana and Prices iFrce uii Application.
REID BROS. LTD., TIMBER and JOINERY MERCHANTS 103 KING WILLIAM ST., ADELAIDE
Consign Your Citrus Fruits To H. LOUEY PANG & C O . PTY. LTD. 172—6 LITTLE
BOURKE STREET, MELBOURNE Account sales promptly rendered with Cheque
Immediately after gale. ""L P"" will And us. Stencils and advice noteB sent on
application. The

of Australasia Limited. Capital Paid up£4.000,000 Total Assets l9l4 y&fiMJOM;
19251 X 4 1 1 7 Z 7 7 5 All classes of banking business conducted at 299
branches and 170 agencies in Australia The J3*nk provides a complete service
to its customers and , connections. This includes Current Accounts, Fixed
Deposits, Overdrafts, Discounts, Collections, Drafts payable in Australia or
abroad, Travellers' and Merchants' Letters of Credit, Telegraphic Transfers.
ARRANGEMENTS FOR CONDUCTING Foreign Banking Business .haw^jpn':- a world-wjde
teii^i^S^il^e^ih^j^^e, Biuflc's officts 'Clr :,In fton4on iairid^•A^te ^ e v ^
jir^oTtartttlty.

"
258664478,/newspaper/258664478,Advertising,Advertising,1925-05-09,1,1,https://trove.nla.gov.au/ndp/del/article/258664478?searchTerm=text%3A%226+little+bourke+street%22%7E0,1585,"Sunraysia Daily (Mildura, Vic. : 1920 - 1933)",0.58263725,likely to be relevant,,,"REID BROS, for TIMBER Wood and Iron Bnildiigs Write for onr Hoom D*alga Sheet
Pent Post Free oa application. We can supply a Two Roomed Houae cut rffldy tor
Erection for £44 at our yards, Port Adelaide pr FRUIT-DRYING RACKS ,
~.SJUSS!*"" 1 """" REID BROS. LIMITED TIMBER AND IRON MERCHANTS Other Flours
Entirely Eclipsed The Mslio IVi'Mn nrorrs.- ,„ ""•o'f'fil -""IrK b* McAtpin's. »
lute MwMim: - is Hit onlv Si:iw:-Miih-:I I lour. Tie ..iil» I-limr in Victoria
n^ckcd in-Germprouf Canons. Jl'. Different"" tfMtoVV™ jP Seit Raising

Consign Your Citrus Fruits To H. LOUEY PANG & CO PTY. LTD. 172—6 LITTLE BOURKE
STREET, MELBOURNE Account sales promptly rendered with cheque immediately
after sale. I. P will find us Stencils and advice notes sent 011 application.
, FOR GIGS OF HIGHEST QUALITY plain seats, steel nr nil IjiT lyres. Kee A.
TAIT ORANGE AVENUE, MILDURA Phone 192. CARS FOR HIRE OVERLAND CARS £220 The
Economy Car of proved performance Willys Knight Cars «£450 Sleeve Valves,
Lanchester Balancer. The Engine never wears out. You can drive a Willys Knight
until it doesn't owe you a penny. i, NEIL McLEOD District Agent. , • OFFICE
AND GARAGE.^7 Madden Ave. Phoi,es 479^ 187, L-m?-

"
258667240,/newspaper/258667240,Advertising,Advertising,1925-05-30,7,7,https://trove.nla.gov.au/ndp/del/article/258667240?searchTerm=text%3A%226+little+bourke+street%22%7E0,1585,"Sunraysia Daily (Mildura, Vic. : 1920 - 1933)",0.55537623,likely to be relevant,,,"To Keep Perfectly Fit IT dunes vou ALWAYS FIT POK A OAME "" WITH THE KID* ^ 3/-
D I G E S T I V E & L I V E R T O N I C SOLD BY CHEMISTS & COUNTRY
STOREKEEPERS AT 3/ IF YOU HAVE DIFFICULTY IN OBTAINING LOCALLY SEND 8d. FOR
POSTAGE TO THE SOLE PROPRIETOR A N D MANUFACTURER: T. A. DICKSON, Chemist 8
WILLIAMS STREET, GEEL0NG. Mg. Ph. WHEN YOU examine Rolfes lio. 1 __ Grade^
you'll notice

that it contains in rich proportion, the tiny y ""amber tips"" j which form the
i most highly ' ^prized product of the Tea B Plant. These ""ambe» tips"" are the
visible reason . of the surpassing excellence Of Rolfes No. I Grade O U M
Consign Your Citrus Fruits To H. LOUEY PANG & CO. PTY. LTD. 172—6 LITTLE
BOURKE STREET, MELBOURNE Account sales promptly rendered with cheque
Immediately after Bale. ""L P"" will find UE. Stencila anil advice notes aeut on
application. Opportunity It hu been eaid, knocks at eveiy man's door at least
once. Vou may have an excellent alibi, but what's the use—you can't cash
alibies. Have you ever considered the influence of newspaper advertising on
opportunity? It is the main key ""to die door. If you will diaw up a series of
. advertisements and insert diem in rotation in ""Sunraysia Daily,"" we are
positive an increase of business will follow. Others are doing it—why JJM^OUJ
. "" • Phone us and we will. 6enc| our representative to call oiVyoVi.
'Hfe^will be able to offer useful suggestions. Advertise Phones 5 a^td 73 in—
Sunraypia Daily \\-nft-Kt if IJ & r » , ( !

"
258666850,/newspaper/258666850,Advertising,Advertising,1925-05-27,1,1,https://trove.nla.gov.au/ndp/del/article/258666850?searchTerm=text%3A%226+little+bourke+street%22%7E0,1585,"Sunraysia Daily (Mildura, Vic. : 1920 - 1933)",0.546524,likely to be relevant,,,"Berlei Brassieres They are ""Longer Line"" models. That is the secret of their
unequalled comfort, their incomparable control of the heavy bust, and
shoulderblades with flesh about them. That is why they trim the waist so
closely, care for flesh at diaphragm, flatten the corset-top-so neatly,
maintain smooth unbroken lines throughout. Berlei ""Longer Line"" Brassiere 5281
comes in longcloth of fine, firm quality. Slrong filet lace fashions the well-
fitting yoke. The brassiere crosses at the back to tie with tapes in front as
you see it in the picture. Clip the clip'to a hook of the corset and figure-
comfort is complete. Made to fit busts measuring 36 to 48 inches. -Berlei
""Longer Line"" Brassiere 6933 will suit a still heavier bust: its sizes range
from 34 to 52 inches. It is a hook-front model in strong longcloth cleverly
reinforced with heavy self strappings. It is a very hard wearing garment and
highly recommended for everyday use. Berlei ""Longer Line"" Brassieres are a
comfort creation not confined only to full figures. Very many dainty • models
in broche, many of them lacetrimmed, are designed for girls and women of slim
to average propoivions. Whatever your figure, slender, average, or stout, you
need a Berlei Brassiere or Bandeau for sports and dancing is well as for
general wear. . .. Berlei ""Longer Line"" Bruiierei and Bandeaux are > very
inexpensively priced at all leading draper*. 1 Choose your Berlei Brassiere or
Bandeau now; >, there will certainly be a model to suit you exactly.

U.XJ/20/25. Consign Your Citrus Fruits To H. LOUEY PANG & CO PTY. LTD. 172—6
LITTLE BOURKE STREET, MELBOURNE Account sales promptly (endered with cheque
Immediately after sale. ""L P"" will find us. v < Stencils and advice notes sent
on application. Read and Advertise in the Special RED CUFFS EDITION MA

"
258666501,/newspaper/258666501,Advertising,Advertising,1925-05-23,1,1,https://trove.nla.gov.au/ndp/del/article/258666501?searchTerm=text%3A%226+little+bourke+street%22%7E0,1585,"Sunraysia Daily (Mildura, Vic. : 1920 - 1933)",0.5147751,likely to be relevant,,,"REID BROS, for TIMBER Write for our HOD» Dnlga Bheet Pent Poat Free on
application. enn supply & Two noomed House cut rcn.iy for Erec- :I.|J1 fur £44
at our yards, Port Adelaide application. REID BROS. LIMITED TIMBER AND IRON
MERCHANTS KINO WILLIAM STREET HEAD OFFICE AND VARDS, ADELA IDE, Opp. M»J««tlc
Theatre. PORT ADELAIDE, Phona Port 2W» P. O'Hara Wood the rioiluus liayiK
|'U|. lii;i \ .-I"", mel propric tur nf il,i> run I T.niiis Sujiii'y 1"""". at
L'Tl 'i •.illuij. Slici-t, Will Compete in Mildurn Singles Championship, June
6th & 8tii. The Widespread Popularity of lll'jx ynu ta.-l£ llolfc.s Tea yni W
i-i-ase lo wullilcv ;<l llU' widespre:id pupulariiv of Hiis Ijnnnus l.lrncl
I'.uupiisi'd or Hi,' very pi.'k of ,!he lea iTop--lhe li-niler yiiiiim 1,-avcs
whieh cunlaiii so I'ii 1 !! a. p. rci-iil:t^L' nf pinv leii-nifikini.'
sjip—H-'lirs is ileliKlilfiilly free frnni 1 '1- Iwirfliness lhal mars I lie
tlavur of ;,ll ihrisc tn whirh ""ill leavi.s and J talk's ;ire found. For
iviioleMiiiii: n - fr.'sliiui'iil and iiiritiniiaralili' fr.igranci' Ito'l'es
.aunnl fiirpnss.-.l l's < v.Mi..inl.al I,- .if .'liph In III,' pa< l(*l'""
(li.-1-aiisc less 1- rmiulM'd f.n- 111 nialii"" il also Hie Ideal le i for
family use. Try II soon--and v.mi'II kieuv wliv so niaiiv families, a f 1 cr
once tnniiiK Unlf.'s. are never sra'slled Willi ordinary teas again. The Young
Leaves Only"" Consign Your Citrus Fruits To H. LOUEY PANG & CO. PTY. LTD. 172—6
LITTLE BOURKE STREET, MELBOURNE Account saleB promptly rendered with cheque
Immediately after sale. ""L P"" will find us. Stencils and advice notes sent on
application. TIMBER The Cheapest and Best place for all Building Lines Fencing
and Bar); Wires Nettings and all Hftiliware JLines, Melboune limber ^ Trading
Co. RED C L i m

"
