id,url,heading,category,date,page,pageSequence,troveUrl,title.id,title.value,relevance.score,relevance.value,snippet,edition,text
258670038,/newspaper/258670038,Advertising,Advertising,1925-06-24,5,5,https://trove.nla.gov.au/ndp/del/article/258670038?searchTerm=text%3A%226+little+bourke+street%22%7E0,1585,"Sunraysia Daily (Mildura, Vic. : 1920 - 1933)",0.5146075,likely to be relevant,,,"• 7his ffierlei Corselette Vet another charming ami elever inodcl from the
hands of JJerJci tle.si^/jcrs--Corscictte . r^S<SD that fulfils tlie function
of both corset :imJ brassiere for slender to average figures. If you possess
that type of easy graceful figure for which you think a corset of any kind is
unnecessary, Uerlei Corselette ""iSKO is the very earmer.l you need to wear.
Because no figure, however $iir.;. h^we'/vr vonihful, retains its luvelv lines
for verv - v. t;yiu!e and \erv wise control. Apart from the H .vhic>. L«:
!«H'ly to overtake the unjt'reruv : guarded figure, there it- :j v.oi
appeorancc of a figure uneorseted and one 'bf.'aiji r.v.'vo Corseicttc. And a
world of difference a\>Mt from the p- s; i'u .•«!' .'o.tj'i;:',. Vabluon needs
the trim btntinht lines, the siium coiii'oiirs of this Uerlei Corselette ;
comfort call:- for the support it yivt-js ; health demands tl)iit the
abdominal muscles shall receive that suppor: in just the way the Corselette
provide?, il—from below. Herlci Corselette 5880 is planned in pretty pinl;
broche with a triangular elastic section over front and sides. This permits
pertccr freedoiji in sitting, d;tncinu. ;md rlie most strenuous athletic
names. It is made to

fasten quickly and easily at left side with hooks and eyes, ;md finished witli
four adjustable su^pendeis and dainty shoulder-straps. Husts measure 32 to 48
inches. Note the number—5880. Ask for it at any leading draper. It is most
moderately priced. FKEK—The ""Berlei Corselette Booklet of Slim Line Beauty*'
—it sho the spore of ull kinds; it nvpsl* ihe sl-cj ulitul figure*. A book
you'll love to Ii.jvc— and l:etp. Uerlei Ltd.. Degrjves Huikling, Degrav St.,
Melbourne and the bo«k %mU roacli you lice ul' (.h.ityc. CROWN CHEMICAL CO.,
City Road, Sth. Melbourne. Consign Your Citrus Fruits To H. LOUEY PANG & CO.
PTY.' LTD. 172—6 LITTLE BOURKE STREET, MELBOURNE Account sales promptly
rendered with cheque Immediately after sale. ""L P"" will find us. Stencils and
advice notes sent on application.

?

"
258248676,/newspaper/258248676,Advertising,Advertising,1925-08-01,1,1,https://trove.nla.gov.au/ndp/del/article/258248676?searchTerm=text%3A%226+little+bourke+street%22%7E0,1585,"Sunraysia Daily (Mildura, Vic. : 1920 - 1933)",0.5141152,likely to be relevant,,,"Opening of the New Hotel EIGHTH STREET, MILDURA WEDNESDA Y 5th AUGUST at 9
a.m. Superior Accomodation for 90 Guests An Elaborately Planned Gue;t House on
Modern American Hotel Systems. Every Convenience for Ladies Afternoon Teas
specially served in a large and Picturesque Palm Court. Two Spacious Airy
Dining Rooms One to Seat 100 guests and one to seal between 60 and 70. Private
Dinners arranged in Reserved Dining Room. Every Comfort assured in Three
Glorious Sitting 'Rooms. Attractive Billiard Room, containing 2 large tables.
All food hygienically prepared in the latest style Heailli-ineal kitchen. The
Netv Commercial ^ ls jewered mroughout and contains hot and cold water
services in all bedrooms. This luxurious Oasis of North Western Victoria is
almost completely surrounded by the largest and most up-to-date Scenic Balcony
in Australia, from which the beauty of, the River and Vineyard landscape can
be enjoyed.

REID BROS, for TIMBER and JOINERY in supply a TWO-ROOMED HOUSE • in ready for
cn-mlon for £43/7/6 U-M» -B per cent. for catOi. our Yards, Plans and Prices
iFree on Application, REID BROS. LTD., TIMBER and JOINERY MERCHANTS 103 KING
WILLIAM ST., ADELAIDE Consign Your Citrus Fruits To H. LOUEY PANG & CO. PTY.
LTD.

172—6 LITTLE BOURKE STREET, MELBOURNE Account sales promptly rendered with
cheque Immediately alter isle. ""L P"" will And' ua. SteocilH and advice notes
tent on application. ' PROFESSOR F. D. P. MILLER Herbalist and Mafnetic Healer
CURES BY NATURE'S REMEDIES PO NOT SUBMIT TO AN OPERATION nntB you hive twn me;
I will Alacnnec yoor out BC.urnetely, and trefct you eucceMfully. I THEAT
WITHOUT OPERATION Gall Ston««, Liver, KlAne;t, Nerve*. NeurttU. Rh*iinutl«n>
Sciatica, Lumbago, Pllefc Catarrh of Heart and Stomach.. Head Noliet, Bad
Running Sorea, grlcoae Uloers, PtbtuK Infantile ParaJTda, end All Compulntt In
both Mala a,a a Fenkla. Houra Monday, ( ta •; Tuaaday, I to » only; Wadnaiday,
« tD «. . Hurt Street, near Erriri tttraat, BaitaraV avary Friday. CALL,
WHITE, or 'PHONE FOOTSCRAY «M. F. D. P. MILLER, M.A.H.P., 32 WUtekaii Street,
FooUcray

"
258671353,/newspaper/258671353,Advertising,Advertising,1925-07-01,1,1,https://trove.nla.gov.au/ndp/del/article/258671353?searchTerm=text%3A%226+little+bourke+street%22%7E0,1585,"Sunraysia Daily (Mildura, Vic. : 1920 - 1933)",0.49984857,likely to be relevant,,,"BEFORE PURCHASING YOUR NEW CAR, we v. culd respectfully ask you In be sure-
VOH KNOW !!:5:r..j Series. II will pay you .mil please u- Not a N'KW model but
un IMI'K(>VKI' Model. Tlo- .ehUli ui' Sixteen years of UYKKLAND superior
eiigiin-t-rin^. CDMKiniTAllI.K. SICKVICKAHLK. IJ('()X()AI Ii '.\ !. Price.
JJi'L'u. (ii- .by our liberal of deferred payment-;. L ST. Deposit, ami £S/s,
pcriuonlb. See iioili STANDARD and I)K I.l'X AlodeN ;ii iho GARAGE, 97 MADDEN
AVENUE. Phone 479. Neil McLeod DISTRICT .\0E.\T. Consult Mr. JOE KIE, Chinese
Herbalist ORANGE AVENUE. Next Corner NINTH STREET, MILDURA Who IK.S PASSED
SJ.ecial Rxanilnations. Mid WAS for nine.- years liesldent Herbalist in the
I'-ms D- Hospital—Hie laruesl in Piinton. -All diseases Inlerna] and Kxternul,
successfullv 'realeil For Health--C'»nsult Joe KIK. TESTIMONIAL: Mr. .lop Kle,
Chinese Herbalist, Mildura. Dear sir. -I am vtr> plad to say thai: you have
completely cured m» of nicer !n niv sloinaeh within four niontl'.s from llin
time J first eonaulled you 1 had i-c-en a sreat sufferer for over nine \ears,
and during that tlnic I have bt-eli trealeil hi- various doctors, tirr withoul
.-'.iceess: and I am sorry that I rrnild nut have known that von was !n (In-
ili^trlrt and consul'od vou rnrller. I inav say tbnt you thoroughly undersi
""-.( my complain! luniH-d'a'elv von nll"". y,,„ are ;it ui.e-ty to use th'--
h-iler as a testlru<i!i 1 r.I iroin no-. — Youis truly, (Signed) Mrs. CANNING.
•Madden Avenue. Mildura. 4th April, 1»22.

IF WORRY JR OVERWORK IS TAKING TOO HEAVY A TOLL MY ADVICE TO YOU s fake NiE r
""CALLY RECOMMENDED RELIEVES EXHAUSTION FINE OLD WINE, ETC. Recuperative
Sustaining 'Qualities. Wonderful TONIC WINE and Obtainable Everywhere
Throughout Australia. Chemists, Licensed Grocers, and Most Hotels. Sot*
Proprietors. ARNOLD BROS Wine & Spirit 684-386 Flinders Lant, Merchant®.
Melbourne Extra freights* etc., necessitate Inland Towns and Interstate
Traders charge a little more. Consign Your Citrus Fruits To H. LOUEY PANG & C
O PTY. LTD. 172—6 LITTLE BOURKE STREET, MELBOURNE Account sales promptly
rendered with cheque Immediately after sale. ""L P"" will find us. Stencils and
advice notes sent on application.

There's None Better

"
