id,url,heading,category,date,page,pageSequence,troveUrl,title.id,title.value,relevance.score,relevance.value,snippet,edition,text
143012484,/newspaper/143012484,Family Notices,Family Notices,1875-02-06,24,24,https://trove.nla.gov.au/ndp/del/article/143012484?searchTerm=text%3A%227+little+lonsdale+street%22%7E0,460,"The Australasian (Melbourne, Vic. : 1864 - 1946)",2.0655355,likely to be relevant,,,"ANNOUNCEMENTS.

BIRTHS.

ATKINS.—On the 30th ult., at Talbot, the wife of

William Atkins of a daughter.

BRUCE.—On the 29th ult., at 22 Dundas-place, Albert

park, the wife of G. W. Bruce of a son.

COLLS.—On the 28th ult., Mrs. Jonathan Colls, of

Caulfield, of a daughter. Both doing well.

CUMMING.—On the 28th ult., at Violet-cottage, Es-

sendon, the wife of Alexander Gumming of a son.

CALDER.—On the 19th ult., at Hit-or-Miss Hotel,

Hotham, Mrs. J. Calder of twins, still-born.

CAMERON.—On the 27th ult., at the Bank of Victoria,

Carisbrook, Mrs. John Cameron of a daughter.

CARSTAIRS.—On the 1st inst., at Aberdeen-street,

Geelong, the wife of J. G. Carstairs, M.D., of a

son.

DARBYSHIRE.—On the 26th ult., at Bright, the wife of

John Darbyshire, shire engineer, of a daughter.

ETHERIDGE.—On the 23rd ult., at Bank of Victoria,

Malmsbury, Mrs. T. S. Etheridge of a daughter.

FISCHER.—On the 29th ult., at Rowena-parade, Rich-

mond, the wife of A. Fischer of a son.

FOTHERGILL.—On the 30th ult., at 174 Chapel-street,

Windsor, the wife of J. W. Fothergill of a daughter. FULLWOOD.—On the 1st
inst., at Pelham-street,

Carlton, the wife of Richard Jackson Fullwood of

a son.

GARDINER.—On the 30th ult., at Rockingham, Kew,

the wife of S. Gardiner of a son.

HICKS.—On the 30th ult., at Maldon, the wife of John

A. Hicks of a daughter.

HEARN - On the 25th ult., at Wardry cottage, Moonee

Ponds, the wife of James Hearn of a son.

HECHLE.—On the 29th ult., at her residence, Forest-

street, Sandhurst, Mrs. John Hechle, prematurely,

of a son.

LEWIS.—On the 28th ult., at Mawallok, Mrs. William

Lewis of a son.

MISKIN.—On the 20th ult., at Holywell-cottage, St.

Hillier street, Abbotsford, the wife of Mr. John Miskin of a daughter.

MACARTHUR.—On the 18th ult., at Bairnsdale, Gipps Land, the wife of Rowand
Macarthur of a daughter. M'DONNELL.—On the 29th ult., the wife of Richard
William M'Donnell, of Her Majesty's Customs, Mel-

bourne, of a son. Both doing well.

MORRAH.—On the 27th ult., at Ballarat, the wife of

E. W. Morrah of a son.

MORRIS.—On the 27th ult., the wife of Mr. James

Morris, of Yan Yean, of a daughter.

MOORE.—On the 2nd inst., at Windsor, the wife of

Sydney Moore of a daughter.

OAKLEY.—On the 2nd inst., at Waltham-street, Rich-

mond, the wife of George Northwood Oakley of a son. OLIVER.—On the 15th ult.,
at Chiltern, Mrs. D. Oliver of a son.

PURVES.—On 28th ult., at her father's residence,

Brighton, Mrs. James Purves of a son. PINNOCK.—On the 26th ult., at the
Commercial Bank, St. Kilda, the wife of J. D. St. Pinnock of a son.
RICHARDS.—On the 20th ult., at Albert-road, Eme- rald-hill, Mrs. H. Richards
of a son.

SELBY.—On the 26th ult., at Bendigo Hotel, Bourke-

street, Melbourne, the wife of Chas. Selby of a daughter.

SPENCE.—On the 18th ult., at Dunedin, the wife of Edwin J. Spence of a son.

STEPHEN.—On the 28th ult, at her residence,

Murphy-street, South Yarra, the widow of the late

Sidney James Stephen, Esq., of a daughter STRAKER.—On the 5th ult., at her
residence, Three

Crowns Hotel, Victoria-street, West Melbourne, the wife of Chas. D. Straker of
a son.

SPENCE.—On the 30th ult., at Tircarra, East St. Kilda,

Mrs. David Spence of a son.

SOLOMON.—On the 30th ult., at 206 Lonsdsale-street

east, the wife of Joel Solomon of a daughter.

WILSON.—On the 27th ult., at Hartwell, Boroondara,

the wife of G. H. Wilson of a daughter.

WALSH.—On the 24th ult., at Barkly-square, Carlton,

the wife of J. J. Walsh of a daughter.

WILLIAMSON.—On the 1st inst., at the Union Bank,

Stawell, the wife of Samuel Williamson of a daughter.

YOUNG.—On the 17th ult., at Newton, Auckland, N.Z.,

the wife of John Young, late of Park-hill, Hotham, of a daughter.

YOUNG.—On the 11th ult., at 73 York-street west,

Emerald-hill, the wife of Mr. J. R. Young of a son.

MARRIAGES.

COLEMAN—SAUNDERS.—On the 27th ult., at the Church

of England, Mordialloc, by the Rev. W. Singleton, William Alfred, eldest son
of William Coleman, Esq., to Elizabeth Catherine, eldest daughter of

Peter Saunders, and niece of W. G. Raven, Esq., of 205 Smith-street, Fitzroy.
Both of Mordialloc.

COWLEY—BEECHING.—On the 30th ult., at Fitzroy,

James Cowley, late of Daylesford, to Elizabeth Beeching, of Fitzroy.

DE JARDINE—PRIESTLEY.—On the 28th ult., at Christ

Church, South Yarra, by the Rev. W. N. Guinness, Pierre Alphonse Fernand De
Jardin, of Brussels, Belgium, to Amy Ellen Layton, eldest daughter of Alfred
Priestley, Esq., Melbourne.

FARNES—SMILER.—On the 26th ult., at St. James'

Cathedral, by the Rev. M. H. Becher, W. W. Farnes, of Geelong, to Margaret
Smiler, eldest daughter of Mrs. James Watson, of Collingwood.

HILL—EVANS.—On the 18th ult., at St. Patrick's,

Kilmore, by the Rev. P. Moran, assisted by the Rev. M. Farrelly, Edward, son
of the late William Hill, to Mary Jane, eldest daughter of Samuel Evans, of
Kilmore. JEFFRIES—FORSYTH.—On the 12th ult., at Tocumwal,

New South Wales, by the Rev. J. M. Ware, George Robinson Jeffries to Annie
Miller, fifth daughter of David Forsyth, late of Dundee, Scotland.

KNIGHT—HART.—On the 27th ult., at St. Phillip's

Church, Collingwood, William, third son of Mr. Humphrey Senhouse, Knight, to
Alice, eldest daughter of Mr. Stephen Hart, Collingwood.

LEE—KIRBY.—On the 30th ult., at St. Mary's Church,

Hotham, by the Rev. H. England, Augustus, fourth son of the late Peter Lee,
Esq., solicitor, Win- chester, England, to Harriette May, eldest sur- viving
daughter of the late William Kirby, Esq., of

Bushfield, County Clare, Ireland.

MARSHALL—HALL.—On the 28th ult., at the residence

of the bride's father, Adolph-street, Richmond, by the Rev. J. Bagley, Robert,
second son of Mr. James Marshall, Menstry-villa, Highett-street, Richmond, to
Malinda, eldest daughter of Mr. George Hall, Adolph-street, Richmond.

OLIVER—MOSS.—On the 28th ult., at the residence of

the bride, by the Rev. L. Fison, Edwin Francis Danby, second son of Wm.
Oliver, Esq., East Gardiner, to Fanny, youngest daughter of James Moss, Esq.,
Hawthorn. No cards.

PARKER—HAMMON.—On the 23rd ult., at Christ Church,

South Yarra, D. M. Parker, Melbourne, to Agnes Jane, widow of the late A. H.
Hammon.

ROBINSON—KEITZ.—On the 30th ult., at St. Stephen's

Church, Richmond, by the Rev. J. Thompson, Pembrook E. Robinson to Eliza
Keitz, widow of the late William Keitz, of Melbourne.

SCOT—RAMSDALE.—On the 1st inst., by the Rev. W.

A. Quick, Duncan Scot to Louisa, eldest daughter of John Ramsdale, of
Melbourne.

DEATHS.

ARMSTRONG.—On the 1st inst., at 10 Peel-street,

Hotham, Charles Samuel, son of Samuel Arm- strong, aged eight months.

BLADE.—On the 21st ult., Mr. Jeremiah Blade, after

a long and painful illness, aged 64.

CORNWELL.—On the 26th ult., at 6 St. Vincent-place

south, Emerald-hill, after along and painful illness, George Edmond, eldest
son of Mr. George Cornwell, contractor, aged 19.

COOK.—Accidentally drowned, on the 24th ult., off the

Omeo Steamer, on the passage from Newcastle, William Cook, of Canterbury,
Kent, England, in the 31st year of his age. English and Tasmanian papers
please copy.

DRAPER.—On the 27th ult., at Williamstown, Lloyd

Felix Combe, the beloved son of Henry and Ellen Draper, aged one year and one
month.

DAWES.—At his residence, Albert-street, Sandhurst,

Mr. Albert Dawes, late of Melbourne, after a short illness, aged 23.

DENBIGH.—On the 30th ult., at Elwood, Caroline Agnes,

daughter of John S. Denbigh, of Kew, aged seven

months.

ENGLISH.—On the 28th ult., at New-street, Middle-

Brighton, John Robson, youngest son of Adam and Margaret English, aged three
years and five months. EVANS.—On the 23rd ult., at Sydney-street, Kilmore,

Bridget Mary Anne, beloved wife of Samuel Evans, in the 40th year of her age.

FLETCHER.—On the 31st ult., at Pakington-street,

Kew, Arthur Pitman, infant son of James and M. Edith Fletcher, aged one year.

FERGUSON.—On the 29th ult., at Emerald-hill, Mr.

William Ferguson, tailor, aged 52 years.

FENNER.—On the 28th ult., at Fitzroy, Blanche

Moinette Henrietta, wife of H. F. B. Fenner, aged 23 years.

FRASER.—On the 29th ult., at Geelong, Ethel May,

third daughter of S. and M. Fraser, aged 11 months. FRANCIS.—On the 29th ult.,
at Maryborough, Edgar

Richard, fourth son of Richard and Kate Francis, aged two years and six
months.

GREENLEESE.—On the 30th ult., at No. 2 Belgravia-

terrace, King-street, Adah Louisa, only daughter of John Henry and Amelia
Frances Greenleese.

GALE.—On the 2nd inst., at Chapel-street, South

Yarra, Clara, the beloved child of Charles and Sarah Gale, aged 16 months.

HALTON.—At the residence of his son, Benalla, Mr.

James Halton, late of Newry, Ireland, aged 66 years.

HARTNUP.—On the 10th ult., at his son-in-law's

residence, corner of Otter and Wellington streets, William Henry Hartnup, aged
53, late of Geelong, and Tunbridge, Kent, England.

HERLITZ.—On the 1st inst., at the Lutheran par-

sonage, Gisborne-street, East Melbourne, Katie, second daughter of the Rev.
Herman Herlitz, aged seven years and six months.

HILLS.—On the 29th ult., of congestion of the lungs,

Ada Ursula, youngest daughter of Richard and Marian Alice Hills, of Smith-
street, Collingwood,

aged three years and ten months.

HART.—On the 13th ult., at Singapore, William Shep- heard C. Hart, Esq.,
eldest son of the late William

Hamilton Hart, Esq., of Melbourne.

JONES.—On the 29th ult., at Canning-street, Carlton,

Alice Jane, the dearly beloved wife of John Jones,

and fourth daughter of Mr. Thomas P. Edwards, contractor, Fitzroy, aged 24
years.

JENNINGS.—On the 1st inst., at the National Bank, Colac, Mary Comrie, infant
daughter of Joseph Gellibrand and Mary Jennings, aged four weeks and two days.

JOHNSON.—On the 2nd inst., at No. 45 St. Vincent-

place, Emerald-hill, of an aneurism of the heart, Alfred Joseph Johnston,
stevedore, in his 46th year. JUST.—On the 1st inst., at Launceston, Jane, the
be-

loved wife of Thomas C. Just, aged 84 years.

KENDALL.—On the 29th ult., at South Yarra, John Awdry, youngest son of
Franklin Richardson Ken- dall, aged one year and four months.

KYLE.—On the 28th ult., at her residence, 56 Charles-

street, Fitzroy, Mrs. Margaret Kyle, widow of the late Mr. David Kyle, of
Edinburgh, aged 60 years.

KENDALL.—On the 29th ult., at South Yarra, John

Awdry, youngest son of Franklin Richardson Ken-

dall, aged one year four months. LEIGHTON.—On the 29th ult., at his residence,
Mac- quarie-street, Williamstown, Captain John George Leighton, late of the
Victorian Pilot Service, aged 50 years. LOXTON.—On the 31st ult., at Kew,
Edward Holland Loxton, aged nine years, eldest and only son of Holland Loxton,
town clerk, Kew. M'ANULTY.—On the 2nd inst., at the City Court, Mel- bourne,
Paul M'Anulty, for many years courtkeeper at the Melbourne County Court, aged
46 years. MACMINN.—On the 4th ult., at Fitzroy, after a short and painful
illness, Mr. James Thomson Macminn,

for many years of the General Post-office, Melbourne,

and late of London ; and nephew of the Rev. Dr.

Thomson, of that place.

M'DOUGALL.—On the 27th ult., at Brunswick, Ernest Robert, youngest son of
Charles and Helen M'Dou-

gall, aged six years and five months.

MORRIS.—On the 27th ult., at his late residence, Rose-cottage, Fitzroy-street,
Fitzroy, Mr. James

Morris, late of Mornington, aged 66 years.

MACKICHAN.—On the 27th ult., at Cartton, lsabella

Christina, the youngest child of Finlay Hugh and Isabella Mackichan, aged 17
months.

MICHIE.—On the 29th ult., at Dagmar-villa, Chomley

street, Prahran, William Alexander, the infant son of Archibald D. and
Catherine Blanche Michie, aged three weeks and five days.

MATTHEWS.—On the 31st ult., at the Dock Hotel,

Willlamatown, Leonard, youngest son of Mr. S. Matthews, aged six weeks.

M'FARLANE.—On the 30th ult., at Isabella-cottage,

Alfred-street, Hotham, Jessie Isabella, youngest child of John and Isabella
M'Farlane, aged 14

months.

MIDDLETON.—On the 31st ult., at the Independent Par-

sonage, Windsor, George Alfred, eldest son of the Rev. W. Middleton, aged 21
years.

MlLLER.—On the 23rd ult., at Sunbury, the infant

daughter of Thomas M. and Annie Miller.

OKEDEN.—On the 22nd December, 1874, at the residence

of her son, police magistrate, Charleville, Queens- land, the wife of D.
Okeden, Esq., aged 58 years.

PEREIRA.—On the 29th ult., at 17 Lonsdale street west,

Amelia Teresa, the beloved wife of Mr. Louie A. Pereira, and only daughter of
Mr. M. Ryan, aged 24

years. R.I.P.

POPE.—On the 31st ult., after a short illness, at the

residence of his mother, 7 Little Lonsdale-street west,

Francis George, third son of the late Edward Pope, aged 22 years and 10
months.

POWIS.—On the 27th ult., at St. John's street,

Windsor, Alexander Frederick, aged six months, the infant son of Captain and
Mrs. Powis, late Of

Madras.

PULLAR.—On the 28th ult., at Echuca, of croup,

William Lewin, the only and beloved child of Wil- liam and Lucy Pullar, aged
15 months.

RICHMOND.—On the 27th ult., at Prospect-house

Academy, Kyneton, Bertha Stella, infant daughter (aged 13 months) of Rev. G.
J. Richmond, Congre-

gational minister.

SAUNDERS.—On the 27th ult., at his late residence,

Highett-street, Richmond, Henry Saunders, eldest son of John Saunders, of the
Government Printing

office, aged 32 years.

SPARLING.—On the 28th ult., at her residence,

Lansdowne-cottage, Lansdowne-street, East Mel- bourne, Mrs. Mary Jane
Sparling, of consumption,

in the 27th year of her age.

STEPHEN.—On the 28th ult., at his residence, Murphy-

street, South Yarra, Sidney James Stephen, clerk of the peace, Melbourne,
eldest son of his Honour Sidney Stephen, deceased, formerly one of the judges
of the Supreme Court, New Zealand, aged

53 years.

STOKOE.—On the 26th ult., at Yarra-street, South

Yarra, Robert William Stokoe, the grandson of the late Robert Blaikie, of
Elsternwick, aged 12 years.

STEELE.—On the 27th ult., at 62 Capel-street, West

Melbourne, after a long and painful illness, Mar-

garet, the beloved wife of John Steele, aged 38 years. R.I.P.

STILL.—On the 29th ult., at East Melbourne, Sarah

Sefton Still, relict of the late Alexander Still, Esq., of Stillton, N.S.W.,
formerly of Rose-hall, Greenock,

N.B., aged 85 years.

URQUHART.—On the 2nd inst., at Yangery-park, near

Warrnambool, Roderick Urquhart, aged 67 years.

VIVIAN.—On the 4th ult., at 2 Jersey-cottages, Church-

street, Richmond, Elizabeth, wife of the late James William Vivian, aged 46
years.

WEBSTER.—On the 20th ult., at Moonee Ponds, John

Campbell Webster, of the firm of Wilkie, Webster,

and Allan, CoIlins-street.

WILSON.—On the 28th ult., at her late residence, 139

Victoria-parade, Alicia Lily, the much loved wife of Surgeon Henry B. Wilson,
aged 32 years.

WHEATLEY.—On the 30th ult., at Essendon, of croup,

William Alfred, son of Wm. P. Wheatley, aged four

years and five months.

"
