id,url,heading,category,date,page,pageSequence,troveUrl,title.id,title.value,relevance.score,relevance.value,snippet,edition,text
60448828,/newspaper/60448828,Family Notices,Family Notices,1869-04-24,99,99,https://trove.nla.gov.au/ndp/del/article/60448828?searchTerm=text%3A%227+little+lonsdale+street%22%7E0,72,"Illustrated Australian News for Home Readers (Melbourne, Vic. : 1867 - 1875)",1.460536,likely to be relevant,,,"BIRTHS, MARRIAGES, DEATHS. BIRTHS. ADENEY. —On the 6th April, at St. Peter's
parson age, Sturt-street, Ballarat, the wife of the Rev. H. W. H. Adeney, of a
son. ASPINALL. —On the 9th April, at View street, Sand hurst, the wife of G.
Aspinall, of a daughter. AARONS. —On the 10th inst., at her residence, Tem ple
of Pomona, Bourke street east, the wife of Mr. Lewis Aarons, of a daughter.
ASH. —On the 10th April, at Modewarre, Geelong, the wife of Edward Ash, of a
daughter, still born. BENNETT. —On the 7th April, at Sussex-street, Linton,
the wife of W. G. Bennett, of a son, both do ing well. BAKER. —On the 9th
April, at Tylden, the wife of Mr. Wm. Baker, C.P.S., of a son. BLANNIN. —On
the 25th March, at Alfred House, Evelyn-street, the wife of Alfred Blannin, of
a son.

BUCKLAND. —On the 1st March, at 168? Cardigan- street, Carlton the wife of Cr.
Thos. Buckland, of a daughter. BLAMIRES. —On the 5th April, at Spring-street,
Mel bourne, the wife of the Rev. W. L. Blamires, of Bel fast, of a son.
BRADBURY. —On the 5th April, at 51 Eyre-street, Ballarat, the wife of Henry
Bradbury, of a daughter. CAMERON. —On the 21st March, at Latimer, Mrs. A. C.
Cameron, of a son. CROW. —On 1st April, at Parker-street, Castlemaine, the
wife of Mr. Henry Crow, of a son. CAMPBELL.—On the 31st March, at Dryburgh-
street, West Melbourne, the wife of Mr. J. Campbell, of a son. CAMERON. —On
the 30th March, at Aberdeen-street, Geelong, the wife of Hugh F. Cameron, of a
son. DALY. —On the 30th March, at Scotch Hotel, Main street, Ballarat, Mrs.
Thomas Daly, of a daughter. DUNCAN. —On the 4th April, at her residence,
Jersey Reef, Inglewood, the wife of Mr. John Duncan, of a son. DITCHFIELD. —On
the 18th April, at Skipton-street, Ballarat, the wife of Mr. Ditchfield, of a
son. ELDEN. —On the 12th April, at Sydney-place, Gee long, the wife of Charles
J. Elden, of Mount Moriac, of a son. EDDIE. —On the 1st April, at Ballarat,
the wife of John Alexander Eddie, of a son. FRANKLYN.—On the 7th April, at
Newbury-house, Beach, Brighton, Mrs. F. B. Franklyn, of a son. FERRIS. —On the
19th April, at her residence, North wood, Mrs. D. C. Ferris, of a son.

GIBB. —On the 6th April, at Webster-street, Bal larat, Mrs. John Gibb, of a
son. HALLEY. —On the 11th April, at Little Park-street, South Yarra, the wife
of Mr. J. Halley, of a son. HARWOOD. —On the 6th April, at seven o'clock p.m.,
at Skene-street, Geelong, the wife of Mr. T. C. Har wood, of a daughter.
HENDERSON. —On the 6th April, at O'Connell-street Hotham, the wife of Thomas
Henderson, of a son. REID. —On the 5th April, at Warrenheip-street, Buninyong,
Mrs. T. H. Reid, of a son. HARVEY. —On the 31st March, at Buninyong, Mrs. R.
M. Harvey, of a daughter. HATHORNE. —On the 1st April, at her residence,
Seymour street, Ballarat, Mrs Charles Hathorne, of a son. JAMES. —At 80
Elizabeth street, Melbourne, 29th March, Mrs Henry James, of a son. LARNACH.
—On the 2nd March, at Melbourne, the wife of G. M. Larnach, of a son. LAMB.
—At South Deniliquin, on Friday, 2nd April, the wife of Mr Decimus Lamb, of a
daughter. LYONS. —On the 4th April, at her residence, Nott-

street, Sandridge, the wife of J. O. Lyons, operative chemist, of twin
daughters. LOWE. —On the 1st April, at St. John's, Kildare, the wife of T.
Lowe, of a daughter, still-born. LORIDAN. —On the 5th April, at Sandhurst, the
wife of Mr J. B. Loridan, of a son. LOGAN. —On the 11th April, at Laurance-
street, Dunolly, Mrs J. C. Logan , of a son. MACGILLIVRAY. —On 13th April, at
the Hospital, Sandhurst, Mrs MacGillivray, of a daughter. MOORE. —On the 5th
April, the wife of W. A. Moore, Bathdowne-street, Carlton, of a son. MARTIN.
—On the 9th of April, at Gheringhap-street, Geelong, Mrs D. Martin of a son.
MANSFIELD. —On the 26th of February, at the resi dence of Mr. John McGregor,
Argyle-street, near the Wharf, Mrs. Mansfield of a daughter, stillborn.
MITCHELMORE. — On the 26th March, at Williams town, Mrs J Mitchelmore of a
son. PATEY. —At Sandhurst, on 27th March, the wife of W. H. Patey, of a
daughter. PLAISTED. —On the 27th March, at No. 190 Cecil- street, Emerald-
Hill, the wife of Philip C. Plaisted, of a daughter. PARKINSON. —On the 13th
April, the wife of Mr Robert Parkinson, of O'Connell-street, Ashby, Geelong,
of a daughter.

POTTS. —On the 10th April, at Koroit street, Warr nambool, the wife of Mr D.
Potts, of a son. ROBERTSON. —On the 26th March, at Talbot, the wife of Charles
G. Robertson, of a daughter. ROBERTSON. —On the 2nd April, at 28 Eyre- street,
Ballarat, the wife of Mr David Robertson of a son. REID. —On the 3rd April, at
the Bank of New South Wales, Eaglehawk, the wife of John Reid, of a daughter.
ROWE. —On the 27th March, at Naringale, the wife of H. Rowe, jun., of a son.
SHOPPEE. —On 26th March, at her residence, Bridge- street, Ballarat, the wife
of Mr C. C. Shoppee of a daughter. SMITH.—On the 27th March, Mrs L. L. Smith,
of a daughter. Mother and daughter both well. STILWELL. —On the 23rd March, at
Williamson- street, Sandhurst, Mrs C. R. Stilwell, of a son. SEARLE. —On the
24th March, Mrs. W. H. Searle, Moorabool-street, Geelong, of a son.
STRACHAN.—On the 23rd March, at the Prince of Wales Hotel, Daylesford, Mrs J.
M. Strachan, of a son. SCOTT. —On the 18th April, at Hamilton, the wife of
Walter Scott, M.D., of a daughter. WELLS. —On the 9th April, at the Wesleyan
Par

sonage, Forest-street, Sandhurst, the wife of the Rev. W. P. Wells, of a
daughter. WALKER. —On the 28th March, at her residence, Skipton-street,
Ballarat, Mrs Geo. Walker of a daughter. Both doing well. WYNNE. —On the 31st
March, at her residence, Grant- street, Inglewood, the wife of Mr J. Wynne,
C.E., of a daughter. YOUNG. —On the 23rd March, the wife of Mr Charles Young,
of the Loddon, of twins. MARRIAGES. BALL - GANGE.—On the 25th March, at
Garrangill, the residence of the bride, by the Rev. George Good- man, Joseph
Ball, Esq., of Murrodoc, to Jemima Susanna, eldest daughter of the late Thomas
Grange, Esq. BYRNE - CRAWFORD.—On the 14th January, at the Congregational
Church, Forest-street, Sandhurst, by the Rev. Mr Lewis, Mr Stephen Byrne,
printer, to Miss Elizabeth Eillnor Crawford, daughter of Mr Charles Crawford,
of the Bath Hotel, Sandhurst. CHEESE - TURNBULL.—On the 26th March, at the
Wesleyan Parsonage, Emerald-hill, by the Rev. Mr Aldison, James Cheese,
butcher, of North Melbourne, to Mary Ann, second daughter of the late Mr John
Turnbull, of Windsor. CROSBIE - McERVIL.—On the 29th March, at the re- sidence
of the bride, by the Rev. James Campbell, Robert Crosbie, of Ballarat, to Jane
McErvil, of Carngham. DIXON - WYLD.—On the 27th March, at 161 Cam- bridge-
street, Collingwood, by the Rev. James Mirams, Frederick Dixon, of Heathcote,
youngest son of the late John Dixon, of Simmington, to Matilda, eldest
daughter of George Wyld, of Prahran. DOIG - ANDERSON.—On the 25th March, at
the resi- dence of the bride's father, by the Rev. John Summers, Mr George
Watson Doig, of Wedderburn, to Mary, eldest daughter of Mr James Anderson, of
Inglewood.

CAME - MUDGE.—On the 29th March, at Lydiard- street Wesleyan Church, Ballarat,
by the Rev. James Watsford, Mr Henry Came to Fanny Maria Mudge. DAWSON -
FOSTER.—On the 29th March, at St. Jame's Cathedral, Melbourne, by the Very
Rev. the Dean of Melbourne, Mr Phillip Dawson, of Inglewood, to Marianne,
second daughter of John Foster, Esq., late of Fitzgerald Valley, Bathurst, New
South Wales. EADIE - MEIKLE.—On the 25th March, at the Pres- byterian Manse,
Myers-street, Sandhurst, by the Rev. James Nish, William C. Eadie, Sandhurst,
to Isabella, fourth daughter of Mr James Meikle, Rowan- street, New Chum.
EVANS—HENRY.—On the 25th March, by the R v. W. R. Croxton, at All Saints'
Church, Sandhurst, G. C. Evans, of View-place, Sandhurst, to Emily Rose, only
daughter of the late J. W. Henry, Esq., of Ade- laide. ESLER—PALMER.—On the
6th April, at St. Paul's Church, Ballarat, by the Rev. R. T. Cummins, Robert
Esler, Esq., of St. Kilda, to Eliza, relict of the late Mr George Palmer,
Ballarat. FAWKNER - MACINTOSH.—On the 29th March, at the residence of the
bride's father, by the Rev. W. A. Lind, John, only son of Matthew Fawkner,
Esq., of Spring Mount, Rochford, to Margaret, eldest daughter of James
Macintosh, of Moyfield, Romsey. FEARN—HARRINGTON.—On the 28th March, at
Tarnagulla, by the Rev. J. M. Shanahan, Mr. F. Fearn, of the District Survey
Office, Dunolly, to Miss Kate Harrington, of Sandhurst. GORDON—COLQUHOUN.—At
Happy Valley, Argyle on 2nd April, by Rev. William Campbell, Hugh Gor- don,
Esq., Wodnaggerak, county Ripon, to Miss Annie Colquhoun, daughter of Mr John
Colquhoun. farmer, Happy Valley, Linton, Victoria. Home papers, please copy.

HENTY—PINNOCK.—On the 8th inst., at Trinity Church, East Melbourne, by the
Venerable Archdeacon Crawford, Thomas Henty, of Pakenham Park, youngest son of
the hon. James Henty, M.L.C., to Lucy Mary, eldest daughter of James Denham
Pinnock, Esq., of Wellington-parade, East Melbourne. Home papers copy.
HARRISON—HALL.—On the 13th April, at St. Paul's Church, Ballarat, by the Rev.
R. T. Cummins, Cornelius Jackson Harrison, to Ellen Sophia, second daughter of
Samuel Thomas Hall, formerly of Staver- ton, Northamptonshire, England. LAMONT
- DOWN.—On the 25th March, at St. Augustine's Church, Inglewood, by the Rev.
H. C. M. Watson, incumbent, Herbert Lamont, of Ingle- wood, solicitor, to
Jane, fourth daughter of Mr. Daniel Down, of Penshurst. LANGHORNE—ROCHE.—On
the 5th April, at St. Mary's Church, Geelong, Edward Morphy Langhorne to
Theresa Roche. LEWIS - DENNAHY.—On the 31st March, by the Rev. E. King, Mr
Thomas Lewis, late of Glamorganshire, to Miss Anna Dennahy, late of
Castlemaine, county Kerry. LEWIS - FREEMAN.—On the 8th April, at the resi-
dence of the bride's parents, by the Rev. James Lind- say, Mr John Lewis of
the New North Clunes Company, Clunes, to Amelia Oxley, eldest daughter of Mr
John Freeman, Duke of Wellington Hotel, Launceston, Tasmania. MORGAN -
WALTERS.—On the 10th April, at Ur- quhart street, Ballarat, by the Rev. W. M.
Evans, Mr Jenkin Morgan, of Sebastopol, to Miss Margaret Walters, of Ballarat.

MOFFATT - RODGERS.—On the 6th April, at the Wesleyan Church, Forest-street,
Sandhurst, by the Rev. W. Hill, John Thomas Lowry Moffatt, Pall Mall,
Sandhurst, to Mary Emilie, eldest daughter of the late Mr Edward S. Rogers,
Welshpool, Montgo- meryshire. MOORE - MILNE.—On the 29th March, by the Rev. Mr
Tonkin, at the Bible Christian Church, Soldiers'-hill, Mr Martin Moore, to
Miss Jessie R. Milne, both of Pleasant Creek. OGLETHORPE - SQUIRE.—On the 31st
March, in the Primitive Methodist Church, Pakington-street, Ashby, by the Rev.
J. Langhem, the Rev. J. Oglethorpe, of Brighton, eldest son of Mr J.
Oglethorpe, of Eaglethorpe, Bendigo, to Miss Squire, of Ashby, daughter of Mr
H Squire, of Kingscott, St. Giles, Devon, England. PEVERELL - UNDERWOOD.—On
the 29th March, at the residence of the bride's uncle, 77 Coventry-street,
Emerald-hill, by the Rev. William Witney, of Brighton, James Peverell, farmer,
of Clunes, youngest son of Mr James Peverell, of Nottingham, England, to
Crescat Carter, only daughter of Mr Wm. Underwood, late of Melbourne.
Nottingham papers please copy. REID - RANKIN.—On the 27th March, at the Manse,
Myers-street, Sandhurst, by the Rev. James Nish, Archibald Reid, to Martha,
second and only daughter of Mr James Rankin, Back Creek. ROBERTS - OWEN. — On
the 14th April, at Ballarat, by the Rev. W. H. Evans, Mr. Henry Roberts, son
of Captain David Roberts, late of Portuadoc, Carnarvon- shire, to Miss Frances
J. Owen, eldest daughter of Mr John Owen, of Harlech, Merionethshire, both at
present of Ballarat. SANTLEY - HARRISON.—On the 8th April, at the resi- dence
of the bride, by the Rev J. Firth, Alfred Santley, to Elizabeth Harrison, both
of Point Henry. SMITH - CLARKE.—On the 23rd March, by the Rev. Dr Cusseck
Russell, Mr Archibald Smith, of Mount Gambier, to Mary Ellen Elizabeth, eldest
daughter of the late Captain J. H. Clarke, Merino. SAVIGE - POWELL.—At
Branxholme, on Good Fri- day, by the Rev. J. M. Roberts, Mr T. S. Savige,
master of South Branxholme common school to Anne Russell, Eldest daughter of
Mr J. Powell, Wellington-street, Collingwood.

STEEL - GRAY.—On the 2nd March, at the residence of the bride's parents, by
the Rev. W. F. Main, John Guthrie Steel, eldest son of the late Mr Charles
Steel, of Glasgow, to Bertha Anderson, youngest daughter of James Gray, late
of Airdire, Scotland. Home papers, please copy. TAME - METCALFE.—On 20th
March, at All Saints' Church, by the Rev. J. Pryce, B.A., Mr G. Tame,
plasterer, to Miss Dorothy Metcalfe, fifth daughter of Thomas Metcalfe, Esq.,
and grand-daughter of the late Rev. Francis Metcalfe, vicar of Kirkbride, Cum-
berland. Home papers, please copy. TOWNES— ASKEW— On the 12th April, at All
Saints' Church, Sandhurst, by the Rev. W. K. Croxton, Henry Hansler, son of Mr
John Townes, of Sandhurst, to Mary EIizabeth, third daughter of the late Mr
John Askew, late of Melbourne and Sandhurst. VIGAR - BLYTH.—At his brother's
residence, West Geelong, by the Rev. Samuel Hewlett, John D. Vigar, of Yeo,
near Colac, to Berth Blyth, of Wagga Wagga, New South Wales. WENBORN -
GULLOCK.—On the 10th April, at St. Paul's Church, Sandhurst, by the Rev. G. P.
Despard, Walter Arthur Jones, son of Mr George Wenborn, London, to Susan
Welsford, only child of Mr Thomas Gullock, of Devon Cottage, View street,
Sandhurst. WRIGHT - TIDSWELL.—On the 25th March, at Dunolly, by the Rev. J. S.
H. Royce, James Wright, to Ruth Sophia Tidswell, both of Dunolly. DEATHS.
ALLEN.—On the 26th March, after a lingering ill- ness, Robert Allen, actuary
of the Belfast Savings Bank, aged forty-four years. BROWN.—On the 29th March,
at the Commercial Hotel, Benalla, after a lingering illness, Mary, the beloved
wife of Edwin Brown.

BAILEY.—On the 26th March, at Preston, of heart disease, Hannah Naomi Bailey
the beloved wife of Thomas Bailey, and daughter of the late Jonathan Hale, of
Sudbury, Suffolk, England, aged forty years. Suffolk and Cambridge papers,
please copy. BILTON. — On 24th March, at Ballarat, Ada Florence second
daughter of Mr W. H. Bilton, aged eight years and five months, of typhoid
fever. BOASE.—On the 8th inst., at his residence, Pall Mall, Sandhurst, Arthur
Tonkin, only son of E. Ley Boase, draper, aged fourteen months. BRICKMANN.—At
Chewton, on the 21st March, Barbara, wife of Wm. Hy. Brickmann, Esq., late of
Highcliff House, Somerset, England. CAMERON.—On the 7th April, at his
residence, Spring Vale, Merri Creek, James Cameron (formerly of Bald hills),
aged forty years. CARMICHAEL.— On the 28th March, Margaret Janet, youngest
daughter of Mr Archibald Carmichael, of Webster street Ballarat, aged nine
months. CAHIR.—On the 27th March, at her residence, Su- therland's Creek,
Mary, aged 37 years, the beloved wife of Michael Cahir, farmer.

CAMERON.—On the 1st April, at Lal Lal, Duncan Alexander, the youngest son of
the late Donald Cameron, aged one year and eight months, of inflam- mation of
the lungs. CRANN.—On the 25th March, at the station of W. F. Armytage, Esq.,
Duck Ponds, John Crann, aged thirty-five years. COCKS.—On the 29th March, at
Little Ryrie street, Geelong, Minnie Rachel, aged eight weeks, infant daughter
of David Cocks. CRAIK.—On the 8th April, at Scottish Hotel, Dana- street,
Ballarat, of consumption, Peter Kevan Craik, youngest son of Mr Wm. Craik,
Newtonstewart, Wigtownshire, Scotland, aged nineteen. CRANE.—On the 11th
inst., at No. 2 Canning-ter- race, Carlton-street, Carlton, Henry Crane, late
of the firm of J. Crane and Co., Commercial road, London, and nephew of Joseph
Crane, Esq., aged thirty-one years. DICK.—On the 25th March, at Latrobe
terrace, Chilwell, Geelong, Agnes, aged twenty years, youngest daughter of
John and Elizabeth Dick, formerly of St Ninian's, Stirlingshire, Scotland.
DAY.—On the 4th inst, at Brighton, at the residence of her brother, Mary
Sarah, eldest daughter of Charles Richard Day, of Wheatland Villa, Nelson-
street, East Prahran. DOWLING.—On the 29th March, at the Baptist Chapel House,
York-street, Launceston, in the 89th year of his age, and the 63rd of his
ministerial labors, the Rev. Henry Dowling, formerly of Worcester and
Colchester, England. His end was perfect peace. ENGLISH.—On the 12th April, at
Ballarat, Ellen Jane, beloved daughter of Mr Richard English, aged thirteen
months and twelve days. EDWARDS.—On the 11th April, at Bridge Hotel, Bealiba,
Johannah Edwards, wife of Morgan Ed- wards. FRANKLIN.—On the 9th April, at
Kew, Mary Frank- lin, second daughter of the late John Franklin, Esq.,
formerly of H.M.'s Customs, London, aged sixty six years. FRASER.—On the 28th
March, at Kilmore, Charles Robert Whytehead Fraser, in the thirty-second year
of his age, eldest son of Rev. William Fraser, Bulla, and Manager of the Bank
of Victoria, Kilmore. GRANT.—On the 8th April, at No. 48 Russell-street,
Wilhelmina McBeth, third daughter of the late Thomas Grant, Esq., of
Switzerland Station, Goulburn River, Yea, aged thirty-four years. HARWOOD.—On
the 7th April, at a quarter to one a.m., at Skene-street, Geelong, Blanche
Agnes, daughter of Mr T. C. Harwood, aged six years and three months.
HEPBURN.—On the 3rd April, at her residence, Ni- cholas-street, Irishtown,
Geelong, Elizabeth, aged forty-nine years, the beloved wife of Mr Thomas Hep-
burn. HONEY.—On the 5th April, William Honey, Esq., of Stone Park, Barrabool-
hills, aged fifty-five years. Devonshire and Cambridge papers please copy.
HATCH.— On the 23rd March, at Castlemaine, Wil liam, the beloved son of Mr J.
D. Hatch, aged four months. JONES.—On the 16th March, at his residence, Fern-
hill, Dunedin, New Zealand, John Jones, aged sixty years. LINDSAY.—On the 28th
March, at the residence of his father. Hunter-street, Castlemaine, Wm. Henry
Knox, youngest son of Mr Lindsay, saddler, aged eighteen months. LOVEGROVE.—On
the 26th of March, Sally, the be- loved wife of Charles Lovegrove, draper, of
Happy Valley. LAVEZZOLO.—On the 12th instant, at her late resi- dence, Vincent
street, Daylesford, Caroline, the be- loved wife of John Lavezzolo, aged
forty-nine years. LAMPLOUGH.—On the 8th April, at Albert street, Clunes, of
diphtheria, Robert Edwin, the beloved son of Jeremiah and Dorah Lamplough,
aged 1 years and 3 months. LEWIS.—On the 14th April, at the hospital, Geelong,
Ann, wife of Mr George Lewis, aged thirty-four years.

MILBURN.—On the 9th April, at the residence of James Taylor, Woodside Farm,
Colvinsby, James Mil- burn, aged fifty-two years. MURRAY.—On the 8th April, at
his late residence, Murrumburrah, Miles Murphy. Aged fifty years. Requiescat
in peace. McNAUGHT. — On the 6th April, at Chewton, Jessy, eldest daughter of
Wm. McNaught. MEREDITH.—On the 2nd April, at Chewton, Eliza fifth daughter of
Thos. Meredith, aged fourteen months. MILES.—On the 2nd April, deeply lamented
by a very large circle of friends, John Edward Miles, iron- monger, Melbourne
; second son of the late Robert Miles, Esq., cloth manufacturer,
Somersetshire. He died as he lived, the happy Christian. Adelaide and home
papers please copy. McLEOD.—On the morning of the 29th March, near Mount
Battery, Mansfield. John McLeod, farmer, aged forty-five, formerly of Borve,
by Portree, Isle of Skye, Scotland. Scotch papers please copy. MEADER.—On the
23rd March, at the Albion Hotel, Sandhurst, Jane Patience Meader, aged
thirteen months. MEADER.—On the 27th March, at Sandhurst, Annie Meader, the
wife of William Meader, aged thirty- three years. McDONALD.—On the 14th March,
at the residence of his sister, Bullock Creek road, Duncan Forbes, youngest
son ol the late Captain Alexander McDonald, of Aberdeen, Scotland.
O'REILLY.—On the 28th March, at Woodbourne, Jane, the beloved wife of O.
O'Reilly, Esq ; and niece of Major Barnes and Captain Barnes, Kells, County
Meath, Ireland, aged sixty-seven years. Requiescat In peace. POPE. — On the
2nd April, at his residence,. 7 Little Lonsdale-street west, Melbourne, Mr
Edward Pope, aged 52 years. ROBINSON.— On the 31s March, at Richmond, of
inflammation of the lungs Harold E. Robinson, sur veyor, aged 51 years. His
end was peace. REID.—On the 10th inst., at Fernside, near Geelong, David
Boswell Reid, aged one year. SINGLETON.—Died in the Lord—On the 4th April, at
her father's residence, Upper Hawthorn, after only eighteen hours' illness, of
internal haemorrhage, Isa- bella, second daughter of John Singleton, M.D. She
was a dutiful daughter and a loving sister. SMITH.—On the 3rd April, at
Sandlands, Mount Moriac, the residence of his brother-in-law, John Smith, aged
fifty-seven years, brother of Mrs Alexander McDonald.

THOMPSON.—At Crowlands, on the 27th March, John Ardagh Thompson, aged sixty-
six. TUGBY.—On the 27th March, at Yangery, Mr Samuel Tugby, of the Yangery
Prince Hotel, aged fifty-nine. TINKLER.— On. 25th, Maroh. at. Bath Hotel, Mary
Jatte, daughter of John and Jane Tinkler, of Sebas- tian, aged two years and
six months. THEAR.—At Latrobe terrace, Ashby, Geelong, on the 28th March, John
Robert, youngest child of James R. and Annie Thear, aged nine and a half
months. TASKER.—On the 13th April, at his residence, Gheringhap-street,
Geelong, George Francis Joseph Tasker, aged sixty-two years, after a long and
painful illness. Much regretted by all who knew him. VAIL.—On the 9th April,
Julia Emma Vail, the daughter of E. L. Vail, solicitor, aged sixteen years.
WRIGHT.—On the 10th April, at Market square, Geelong, Caroline Ada, aged
eighteen months, twin daughter of Thomas and Emma Wright. WRIGHT.—At the
Grasstree Saw Mill, near Cobden, on the 3rd inst., John Armstrong, first and
only son of Ellen and Armstrong Wright, aged three months. WEBLEY.—On 7th
April, at Branxholme, of diar- rhia, Agnes Eva, the beloved daughter of
William and Catherine Webley, aged fifteen months. WEBB.—On 28th March, at her
residence, Lear- month, Ann, the wife of Mr Thomas L. Webb, aged fifty years.
WALTER.—On 29th March, at Ceres, Barrabool- hills, Bertha Beatrice, daughter
of John and Mary Ann Walter, aged three years and ten weeks. WALLACE.—On the
28th March, at Wurruk, Wur- ruk, Gipps Land, Mr Robert Wallace, in his 68th
year. WILKINSON.—On the 25th March, at Kars-street, Reechworth, Jane
Elisabeth, only daughter of Mr Thomas Wilkinson ; aged ten months ; late of
Buck- land. WOOTON.—On the 25th March, at Romsey, Peter Wooton, butcher,
native of Margate, England.

"
