id,url,heading,category,date,page,pageSequence,troveUrl,title.id,title.value,relevance.score,relevance.value,snippet,edition,text
11514507,/newspaper/11514507,Family Notices,Family Notices,1875-03-31,8,8,https://trove.nla.gov.au/ndp/del/article/11514507?searchTerm=text%3A%227+little+lonsdale+street%22%7E0,13,"The Argus (Melbourne, Vic. : 1848 - 1957)",7.717746,very relevant,,,"Funeral Notices.

repair remains of the late WILLIAM CHARLES J. BIDDLE will be interred in the
St Kilda. Cemetery. at 4 p in 'This Day (Wednesday), the 31st March, 1876 Alf
Aug Sleight, undertaker.

Till. Friends of the late Mr JOHN O LEARY are respectfully invited to follow
his remains to the place of interment, Melbourne General Cemetery. The funeral
to move from his late residence, No 7 Little Lonsdale street west, on
Thursday, the 1st Inst.

"
7145832,/newspaper/7145832,Family Notices,Family Notices,1857-03-09,4,4,https://trove.nla.gov.au/ndp/del/article/7145832?searchTerm=text%3A%227+little+lonsdale+street%22%7E0,13,"The Argus (Melbourne, Vic. : 1848 - 1957)",6.5942516,very relevant,,,"BIRTHS.

On the 5th inst., at South Yarra, the lady of Henry Jones, Esq., Binnum Binnum
Station, of a daughter.

At her residence, 178 King-street, Mrs. H. D. Brown,

of a son.

On the 8th inst., at St. Kilda, Mrs. Wm. Z. Chal- mers, of a daughter.

On the 6th inst, at her residence, 21 Lonsdale-street, .

MARRIED.

On the 2nd inst., at Geelong, by special license, by the Rev. John Cooper, Mr.
James Hamilton, of Bal- laarat, to Miss Marion Turnbull Whitelaw, late of
Haddington, Scotland.

DIED.

On the 28th February, at Tanilba, N.S.W., after a protracted illness, Helen
Maria, youngest daughter of John Heap, Esq.. formerly of Manchester.

On the 8th inst., at Northcote, near Melbourne, Mr. Joseph Duncan, late of
Dundee, Scotland, aged 65.

On the 7th inst., at his residence, Darebin Creek, Mr. James Bennett, late
timber merchant of Rich- mond, aged 42 years.

On the 7th inst., at the residence of her son-in-law, Patrick Egan, of
Brunswick, Mrs. Mary Carroll, aged 68 years, and mother of Michael Carroll,
late of No. 7

Little Lonsdale-street.

On the 8th inst., at St. Kilda, John James Gordon,

the infant son of George Augustus Gordon, late of Her Majesty's 93rd
Highlanders, aged ten months and seven days. Scotch papers please copy.

"
202136790,/newspaper/202136790,Family Notices,Family Notices,1875-04-01,4,4,https://trove.nla.gov.au/ndp/del/article/202136790?searchTerm=text%3A%227+little+lonsdale+street%22%7E0,809,"The Age (Melbourne, Vic. : 1854 - 1954)",6.48197,very relevant,,,"Funeral Notices. THE Friends of the late Mr. JOHN COCHRANE LOCKHEAD,
coachbuilder, are most respect fully invited to follow his remains to their
last resting place, the Melbourne General Cemetery. The funeral procession is
appointed to move from his late residence. No. 14 Napoleon-street,
Collingwood, this da) (Thursday, the 1st April), at quarter to 2 o'clock
punctually. WILLIAM GEORGE APPS, Undertaker, corner of Fitzroy and Moor
streets, Fitzroy. THE Friends of the late Mr. JOHN O'LEARY are respectfully
invited to follow his remains to the place of interment, Melbourne General
Cemetery The funeral will move from his late residence, 7 Little Lonsdale-
street west, this day, 1st April at one o'clock. JOHN DALEY, Undertaker,
Latrobe and Spring streets, Melbourne. The Friend of Mr. HENRY GOOSE are
respect fully invited to follow the remains of ids late mother to the place of
interment, Melbourne General Cemetery. The funeral to move from her late resi-
dence, Wellington-street, near Swan-street, Richmond, THIS DAY (Thursday), 1st
inst., at three o'clock. THOMAS BELL, Undertaker, 14 Lennox-street, Richmond.
The Friends of Mr. JOHN H. COXELL are re- spectfully invited to follow the
remains of his late wife to the place of interment, Melbourne General
Cemetery. The funeral will move from his residence, 160 Thistlethwaite-street,
Emerald-hill, on Friday, 2nd inst., at three o'clock. JOHN DALEY, Undertaker,
Latrobe and Spring streets, Melbourne.

"
188573850,/newspaper/188573850,Family Notices,Family Notices,1869-04-05,2,2,https://trove.nla.gov.au/ndp/del/article/188573850?searchTerm=text%3A%227+little+lonsdale+street%22%7E0,809,"The Age (Melbourne, Vic. : 1854 - 1954)",6.183987,very relevant,,,"BIRTHS. HARVEY.—On the 31st March, at Buninyong, Mrs     R. M. Harvey, of a
daughter. LOWE.—On the 1st April, at St. John's, Kildare,   the wife of T.
Lowe, of a daughter, still-born. MARRIAGES. FEARN—HARRINGTON.—On the 28th
March, at Tar-     nagulla, by the Rev. J. M Shanahan, Mr F. Fearn, of the
District Survey Office, Dunolly, to Miss Kate Harrington, of Sandhurst.
OGLETHORPE—SQUIRE.—On the 31st March, in the     Primitive Methodist Church,
Pakington-street, Ashby, by the Rev. J. Langham, the Rev. J. Ogle- thorpe, of
Brighton, eldest son of Mr J. Oglethorpe, of Eaglethorpe, Bendigo, to Miss
Squire, of Ashby, daughter of Mr H. Squire, of Kingscott, St. Giles, Devon,
England. DEATHS. BROWN.—On the 29th March, at the Commercial   Hotel, Benalla,
after a lingering illness, Mary, the beloved wife of Edwin Brown. CAMERON.—On
the 1st April, at Lal Lal, Duncan     Alexander, the youngest son of the late
Donald Cameron, aged one year and eight months, of inflam- mation of the
lungs.   MEREDITH.—On the 2nd April, at Chewton, Eliza,   fifth daughter of
Thos. Meredith, aged fourteen months. MILES.— On the 2nd April, deeply
lamented by a very large circle of friends, John Edward Miles, iron- monger,
Melbourne; second son of the late Robert   Miles, Esq., cloth manufacturer,
Somersetshire. He   died as he lived, the happy Christian. Adelaide and home
papers please copy. M'LEOD.—On the morning of the 29th March, near     Mount
Battery, Mansfield. John M'Leod, farmer, aged forty-five, formerly of Borve,
by Portree, Isle of Skye, Scotland. Scotch papers please copy. POPE.—On the
2nd April, at his residence, 7 Little Lonsdale street west, Melbourne, Mr
Edward Pope, aged 52 years.

"
5818890,/newspaper/5818890,Family Notices,Family Notices,1870-04-26,8,8,https://trove.nla.gov.au/ndp/del/article/5818890?searchTerm=text%3A%227+little+lonsdale+street%22%7E0,13,"The Argus (Melbourne, Vic. : 1848 - 1957)",5.9970913,very relevant,,,"Funeral Notices.

THE Friends of Mr. ROBERT CARDAN are re-

spectfully invited to follow the remains of his late wife to the place of
interment, Melbourne General Cemetery.

The funeral to move from his residence, 6 Madeline- lane, off Madeline-street,
Carlton, THIS DAY, at 1 o'clock p.m.

JOHN DALEY, undertaker, Latrobe and Spring

streets, Melbourne. THE Friends of the late Mr. JOSHUA ROBERTS, storekeeper,
are respectfully invited to follow his remains to the place of interment,
Melbourne General Cemetery.

The funeral will leave his late residence, 291 Drummond-street, Carlton, THIS
DAY, at 1 o'clock-.

JOHN DALEY, undertaker, Latrobe and Spring streets, Melbourne.

THE Friends of the late Miss ABAGAIL O'LEARY, daughter of the late Mr. Denis
O'Loary, are re spcctfully invited to follow her remains to the place of
interment, Melbourne General Cemetery.

The funeral to move from her late residence, 7 Little Lonsdale-street west,
Melbourne, THIS DAY, at 3 o'clock p.m.

JOHN DALEY, undertaker, Latrobe and Spring streets, Melbourne.

THE Friends of Mr. CHARLES NICHOLLS are re-

spectfully invited to follow the remains of his late sister-in-law, Mrs.
Mewkill, to the place of interment, the Kew Cemetery.

The funeral to move from his residence, the Post office Hawthorn, THIS DAY, at
3 o'clock p.m.

JOHN PADBURY, undertaker. Kew._

THE Friends of the late Mr. JAMES HUNTER

are respectfully invited to follow his remains to the Melbourne General
Cemetery.

The funeral is appointed to move from his late residence, No. 11 Cecil-street.
Emerald-hill, near the Sandridge-road, at 12 o'clock THIS DAY.

JOSEPH HILL, undertaker, 75 Clarendon-street, Emerald hill.

THE Friends of the late Mr. ANDREW ELLIOTT

are respectfully invited to follow his remains to the place of interment,
Melbourne General Cemetery.

The funeral will leave his late residence, Tyne-cot tage, Campbell-street,
Collingwood, to-morrow, at 2 o'clock p.m.

HENRY ALLISON, undertaker, 40 Victoria-street west Melbourne.

"
241604019,/newspaper/241604019,NEWS AND NOTES IN A NUTSHELL THE BUSY MAN'S COLUMN.,Article,1898-03-12,1,1,https://trove.nla.gov.au/ndp/del/article/241604019?searchTerm=text%3A%227+little+lonsdale+street%22%7E0,1190,"The Herald (Melbourne, Vic. : 1861 - 1954)",5.822803,very relevant,"Another batch of rural holidays and half-holidays proclaimed in this week's ""Government Gazette."" A considerable area of malice land is",,"NEWS AND NOTES IX A NUTSHELL

THE BUSY MAN'S COLUMN.

Another, batch of rural holidays and baJf-hofi'dny.s proclaimed In tills week'
""Government Gazette."" A eon«ldeviililo area of malice html i<j thi week
gazetted a», ojien for selec-

tion under lease or hcuuhc. The return match, Kngland v. Vleto- . rln. 1
living coutiniied to-day on the Melbourne Cricket Ground. Our re port will
appear in later edition. All tlie European powers, except Ger many and
Austria, have uotlfied the VulttHl'Stutes GuvcmmetiLof their in tention to
remain neutral lu the event of war lireaking o'tu between the United State and
Spain. President Kruger make a significant speech. He says Unit there are
Iron- bioiiK time uJiead. for tlie- Transvaal, and . in recommending u cool
storage clienie, state that the Iloers are depen dent .for their food supply
upon fo reigners. ' - Turkey lias for the present settled her financial
difficulty with Russia. Throe- fourths of the war Indemnity to lie re- celvetl
from Greece will be passed on to Russia iu part payment of the war in demnity
claimed after tlie Uusso-Tur- klsh war. of 187(1. A little girl, named Nellie
Gerken, eight years of age, who resides with her parents at No. 7 Little
Lonsdale street, met with a serious accident to-dny. A few minute before eight
o'clock she was placing tlie kettle ou the fire when her. pinafore caught
fire, aud she wo seriously luirned ulsnij' the face and nnuH. She was at once
taken to the Melbourne Hospital, und admitted to the institution b.v l)r.
Doualdron.. -i Tlie, Federal Convention, as anticipa ted, had nn all-nlglit
Hitting, and did not .rise till. -1 .o'clock (Ills morning,. A sununarj' of
the proceedings from the time, thu. first.. editions of. thu morning papers
went to 'press will be found else- where. What-, took place during the last
three hours may be dhscrlhed as ""a chapter of odds aud ends."" Few alter-'
atluus or additions or any consequence were made durlngtlmt purhnl, inostif
the attempt in that direction being re sisted.'

"
11511466,/newspaper/11511466,Family Notices,Family Notices,1875-02-01,1,1,https://trove.nla.gov.au/ndp/del/article/11511466?searchTerm=text%3A%227+little+lonsdale+street%22%7E0,13,"The Argus (Melbourne, Vic. : 1848 - 1957)",5.822791,very relevant,,,"[In order to guard against imposition, notions of

Births, Marriages, and Deaths must be authenti- cated by some respectable
person in Melbourne, to secure their insertion.]

Births.

CAMERON. —On the 27th ult., at the Bank of Victoria,

Carisbrook, Mrs. John Cameron of a daughter.

FISCHER. —On the 29th ult., at Rowena-parade, Rich-

mond, the wife of A. Fischer of a son.

GARDINER. —On the 30th ult., at Rockingham, Kew,

the wife of S. Gardiner of a son.

SPENCE. —On the 30th ult., at Tircarra, East St. Kilda,

Mrs. David Spence of a son.

YOUNG. —On the 17th ult., at Newton, Auckland, N.Z.,

the wife of John Young, late of Park-hill, Hotham, of a daughter.

YOUNG. —On the 11th ult., at 73 York-street west,

Emerald-hill, the wife of Mr. J. R. Young of a son.

Marriages.

FARNES—SMILER. —On the 20th ult., at St. James's

Cathedral, by the Rev. M. H. Becher, W. W. Farnes, of Geelong, to Margaret
Smiler, eldest daughter of Mrs. James Watson, of Collingwood.

MARSHALL—HALL. —On the 28th ult., at the residence

of the bride's father, Adolph-street, Richmond, by the Rev J. Bagley, Robert,
second son of Mr. James Marshall, Menstry-villa, Highett-street, Richmond, to
Malinda, eldest daughter of Mr. George Hall, Adolph-street, Richmond.

Deaths.

DENBIGH. —On the 30th ult., at Elwood, Caroline Agnes

daughter of John S. Denbigh, of Kew, aged seven

months.

KENDALL. —On the 29th ult., at South Yarra, John

Awdry, youngest son of Franklin Richardson Ken- dall, aged one year four
months.

LEIGHTON.—On the 29th ult., at his residence, Mac-

quarie-street, Williamstown, Captain John George Leighton, late of the
Victorian Pilot Service, aged

50 years.

MICHIE. —On the 29th ult., at Dagmar-Villa, Chomley-

street, Prahran, William Alexander, the infant son of Archibald D. and
Catherine Blanche Michie, aged three weeks and five days.

POPE. —On the 31st ult., after a short illness, at the

residence of his mother, 7 Little Lonsdale-street west, Francis George, third
son of the late Edward Pope,

aged 22 years and 10 months.

"
138099393,/newspaper/138099393,A REMARKABLE RECORD.,Article,1885-06-20,44,44,https://trove.nla.gov.au/ndp/del/article/138099393?searchTerm=text%3A%227+little+lonsdale+street%22%7E0,460,"The Australasian (Melbourne, Vic. : 1864 - 1946)",3.8125544,very relevant,"The origin, growth, and final success of any enterprise are causes for the greatest public interest, whether relating to public institutions or private ventures. The western continent has been especially",,"A BEMARKABLE EECORD.

The origin, growth, and final success of any enter prise are causes for the
greatest public interest, whether relating to public institutions or private
ventures. The western continent has been especially marked by examples of this
nature, and we are glad to record one which is so prominent as to be of uni
versal interest. Several years since Mr. H. H. Warner, reading in Rochester,
M.Y., became aware that vhat he supposed was an iron constitution was becoming
rapidly undermined, and that something of a mys terious nature seemed to be
sapping his vitals. At first the indications were slight, consisting prin
cipally of frequent headaches, dull pains in various parts of the body,
unaccountable lassitude, and occasions] naosea. He thought that perhaps these
symptoms were the result of a ooM^uad gave them but little attention, but they
Increased and finally became alarming. Consultation with two prominent
physicians revealed the fact that he was Buffering from aa acute attack of
kidney disease, and to say that he was alarmed would be only to partially
express his feelings. Under the most careful atten tion of the physicians,
however, he failed to improve, and. In (act, grew worse constantly. Bis
symptoms at this time were most serious. The alight troubles which he had
first observed increased, and finally became intense. What originally were
simple pains became the greatest agony. Occasional headaches \- and a lack of
energy eventually resulted in the pains

and honors which only such troubles can bring. It was at this critical time
that he heard of a tropical plant, which was reputed to be of great value in
similar troubles. Be had little faith in its power, but resolved to tnr it, as
nothing else seemed to in any wav relieve him. Be therefore ceased taking the
medicine of the doctors, began the use of the article referred to, and was
aware in a very short space of time that it was greatly ben eS tin* him. He
con tinned its use faith! ally, and as a result became perfectly

oured. has been one of the most active men in Amenoa ever sinoe, and is to-day
a picture of perfect

health.

Mr. Warner's experience caused him to thoroughly and most carefully
investigate, and as a result he dis covered that the majority of common
diseases could be traced in their origin to disorders of the kidneys or liver.
Ibis was a revelation so startling in its nature that, as a duty to humanity,
Mr. Warner felt impelled to make known to the world the great means by which
he had been saved. Up to that time kidney diseases had increased at the rate
of 26 per cent, each year for the past half soore of years, and were stiU
largely on the increase. With the end in ' view above described, however, Mr.
Warner began

preparing and selling the remedy referred to, sinoe i which time the demand
for it has been remarkable.

' In all the history of the world there is no instance on ' reoord where so
great a demand has been known ss . that existing for Warner's Safe Cure in the
United i States, England, and Canada, for all diseases of the

kidneys, liver, and urinary organs, and for sale by i every chemist in the
land. Were the call for this

remedy a fictitious one, mortality from kidney troubles would now be as great
AS ever, but statistics show that, for the past few years, there has been a
marked decrease of deaths from this class of diseases, > although the tendency
toward kidney troubles is as

great as ever. The theory, therefore, which Mr. Warner advanced has been
proven the correct one by reason of tho decrease of mortality shown by Govern
ment statistics.

Not long after presenting this medicine to the American publlo, Mr. Wamer
introduoed it into England. Kidney and liver difficulties are very

Srevalent over there, owing largely to the nature of

te climate and influence of the atmosphere. The

same results, however, which were noticeable In America were to be found in an
equal degree in Europe. The remedy conquered the disease.

Strange as it may seem, this great medicine, which has become so popular in
the United States, England, and Canada, has never been introduoed into
Australia, owing to the fact that the large amount of business coming from the
demand prevented an extension of the field, We learn,- however, that Messrs.
Warner ana Co. have reoently established an Australian house at 1(7 Little
Lonsdale-street, in this city, for the pur pose of supplying the demand which
has already sprang upland our friends arc to be oongratalated on this fact The
financial and social standing of Messrs. H. H. Warner and Co. in the United
States is second to that of no house in existence. The well-known public
spirit and liberality of Mr. Warner in con tributing to the wants of the South
during the yellow fever epidemic; endowing the celebrated Warner Astronomical
Observatory at Booh ester, N.Y., I at an expense of nearly £20,000, aud
encouraging toe I advancement of scienoe by the generous expediture 1 of money
in prises for oometary and meteoric dte

1 coveries, are .known to tt»e entire w<*M. and mark I aim as one of the
leading patrons ot.aeienoe of this

day. Success suub as has.been aautoved by this house, and of so high an order.
Is wholly meritorious sod deserved, and while it is phenomenal, it is none the
less of the greatest value to the entire wjesan continent.-{Ami

"
196478863,/newspaper/196478863,Family Notices,Family Notices,1869-04-10,27,27,https://trove.nla.gov.au/ndp/del/article/196478863?searchTerm=text%3A%227+little+lonsdale+street%22%7E0,319,"Leader (Melbourne, Vic. : 1862 - 1918, 1935)",3.8116899,very relevant,,,"BIRTHS, MARRIAGES, DEATHS. BIRTHS. ADENEY.—On the 6th April, at St. Peter's
parson- age, Sturt -street, Ballarat, the wife of the Rev. H. W. H. Adeney of
a son. DUNCAN.—On the 4th April, at her residence, Jersey Reef, Inglewood, the
wife of Mr John Duncan of a son. EDDIE.—On the 1st April, at Ballarat, the
wife of John Alexander Eddie of a non. HARVEY.—On the 31st March, at
Buninyong, Mrs R. M. Harvey, of a daughter. HATHORNE.—On the 1st April, at her
residence, Seymour street, Ballarat, Mrs Charles Hathorne, of a son. LAMB.—At
South Deniliquin, on Friday, 2nd April, the wife of Mr Decimus Lamb, of a
daughter. LYONS.—On the 4th April, at her residence, Nott- street, Sandridge,
the wife of J. C. Lyons, operative chemist, of twin daughters.

LOWE.—On the 1st April, at St. John's, Kildare, the wife of T. Lowe, of a
daughter, still-born. LORIDAN.—On the 16th April, at Sandhurst, the wife of Mr
J. B. Loridan of a son. REID.—On the 13rd April, at the Bank of New South
Wales, Eaglehawk, the wife of John Reid, of a daughter. ROBERTSON.—On the 12nd
April, at 28 Eyre street, Ballarat, the wife of Mr David Robertson, of a son.
WYNNE.—On the 31st March, at her residence, Grant street, Inglewood, the wife
of Mr J. Wynne, C.E., of a daughter. YOUNG.—On the 23rd March, the wife of Mr
Charles Young, of the Loddon, of twins. MARRIAGES. FEARN—HARRINGTON.—On the
128th March, at Tar- nagulla, by the Rev. J. M Shanahan, Mr F. Fearn, of the
District Survey Office, Dunolly, to Miss Kate Harrington, of Sandhurst.
FAWKNER—MACINTOSH —On the 29th of March, at the residence of the bride's
father, by the Rev. W. A Lind, John, only son of Matthew Fawkner, Esq , of
Spring Mount, Rochford, to Margaret, eldest daughter of James Macintosh, of
Moyfield, Romsey. FEARN—HARRINGTON.—On the 28th March, at Tarnagulla, by the
Rev. J. M. Shanahan, Mr F. Fearn, of the District Survey Office, Dunolly, to
Miss Kate Harrington, of Sandhurst. LAMONT—DOWN.—On the 125th March, at St.
Augustine's Church, Inglewood, by the Rev. H. C. M. Watson, incumbent, Herbert
Lamont, of Ingle- wood, solicitor, to Jane, fourth daughter of Mr Daniel Down,
of Penshurst. LANGHORNE—ROCHE.—On the 6th April, at St. Mary's Church,
Geolong, Edward Morphy Langhorue to Theresa Roche. OGLETHORPE—SQUIRE.—On the
31st March, in the Primitive Methodist Church, Pakington-street, Ashby, by the
Rev. J. Langham, the Rev. J. Ogle- thorpe, of Brighton, eldest son of Mr J.
Oglethorpe, of Eaglethorpe, Bendigo, to Miss Squire, of Ashby, daughter ol Mr
H. Squire, of Kingscott, St. Giles, Devon, England. REID—RANKIN.—On the 27th
March, at the Manse, Myers-street, Sandhurst, by the Rev. James Nish,
Archibald Reid, to Martha, second and only daughter of Mr James Rankin, Back
Creek. SMITH—CLARKE.—On the 23rd March, by the Rev. Dr. Cusseck Russell, Mr
Archibald Smith, of Mount Gaimbier, to Mary Ellen Elizabeth, eldest daughter
of the late Captain J. H. Clarke, Merino. SAVIGE—Powell —At Branxholme, on
Good Fri- day, by the Rev. J. McRoberts, Mr T. S. Savige, master of South
Branxholme common school, to Anne Russell, eldest daughter of Mr J. Powell,
Wellington-street, Collingwood. DEATHS. ALLEN.—On the 26th March, after a
lingering ill- ness, Robert Allen, actuary of the Belfast Savings Bank, aged
forty-four years. BROWN.—On the 29th March, at the Commercial Hotel, Benalla,
after a lingering illness, Mary, the beloved wife of Edwin Brown. CAMERON.—On
the 1st April, at Lal Lal, Duncan Alexander, the youngest son of the late
Donald Cameron, aged one year and eight months, of inflam- mation of the
lungs. DAY.—On the 4th inst , at Brighton, at the residence of her brother,
Mary Sarah, eldest daughter of Charles Richard Day, of Wheatland Villa,
Nelson-street, East Prahran. HEPBURN.—On the 3rd April, at her residence, Ni-
cholas-street, Irishtown, Geelong, Elizabeth, aged forty-nine years, the
beloved wife of Mr Thomas Hep- burn. HONEY.—On the 5th April, William Honey,
Esq., of Stone Park, Barrabool-hills, aged, fifty-five years. Devonshire and
Cambridge papers please copy. McNAUGHT.—On the 6th April, at Chewton, Jessy,
eldest daughter of Wm. McNaught. MEREDITH.—On the 2nd April, at Chewton,
Eliza, fifth daughter of Thos. Meredith, aged fourteen months. MILES.—On the
2nd April, deeply lamented by a very large circle of friends, John Edward
Miles, iron- monger, Melbourne ; second son of the late Robert Miles, Esq ,
cloth manufacturer, Somersetshire. He died as he lived, the happy Christian.
Adelaide and home papers please copy. McLEOD.—On the morning of the 29th
March, near Mount Battery, Mansfield, John McLeod, farmer, aged, forty-five,
formerly of Borve, by Portree, Isle of Skye, Scotland. Scotch papers please
copy. O'REILLY.—On the 28th March, at Woodbourne, Jane, the beloved wife of O.
O'Reilly, Esq , and niece of Major Barnes and Captain Barnes, Kells, County
Meath, Ireland, aged sixty-seven years. "" Requiescat in pace."" POPE.—On the
2nd April, at his residence, 7 Little Lonsdale-street west, Melbourne, Mr
Edward Pope, aged 52 years. SINGLETON.—Died in the Lord —On the 4th April, at
her father's residence, Upper Hawthorn, after only eighteen hours' illness, of
internal haemorrhage, Isa- bella, second daughter of John Singleton, M.D. She
was a dutiful daughter and a loving sister. SMITH.—On the 3rd April, at
Sandlands, Mount Moriac, the residence of his brother-in-law, John Smith, aged
fifty-seven years, brother of Mrs Alexander McDonald. THOMPSON.—At Crowlands,
on the 27th March, John Ardagh Thompson, aged sixty-six. TUGBY.— On the 27th
March, at Yangery, Mr Samuel Tugby, of the Yangery PrinceHotel, aged fifty-
nine. WOOTON.—On 6th March, at Romsey, Peter Wooton, butchen, native of
Margate, England.

"
